,steam_appid,categories,genres,header_image,short_description,meta
0,550,"['Single-player', 'Multi-player', 'PvP', 'Online PvP', 'Co-op', 'Online Co-op', 'Steam Achievements', 'Full controller support', 'Steam Trading Cards', 'Captions available', 'Steam Workshop', 'Steam Cloud', 'Valve Anti-Cheat enabled', 'Stats', 'Includes Source SDK', 'Commentary available', 'Remote Play on Phone', 'Remote Play on Tablet', 'Remote Play on TV', 'Remote Play Together']",Action,https://cdn.akamai.steamstatic.com/steam/apps/550/header.jpg?t=1657220736,"Set in the zombie apocalypse, Left 4 Dead 2 (L4D2) is the highly anticipated sequel to the award-winning Left 4 Dead, the #1 co-op game of 2008. This co-operative action horror FPS takes you and your friends through the cities, swamps and cemeteries of the Deep South, from Savannah to New Orleans across five expansive campaigns.",89
0,1222670,"['Single-player', 'Steam Trading Cards', 'Remote Play on Tablet']",Casual,https://cdn.akamai.steamstatic.com/steam/apps/1222670/header.jpg?t=1657912698,Play with life and discover the possibilities. Unleash your imagination and create a world of Sims that’s wholly unique. Explore and customize every detail from Sims to homes–and much more.,
0,255710,"['Single-player', 'Steam Achievements', 'Steam Trading Cards', 'Steam Workshop', 'Partial Controller Support', 'Steam Cloud', 'Includes level editor', 'Remote Play on Tablet']",Simulation,https://cdn.akamai.steamstatic.com/steam/apps/255710/header.jpg?t=1654076112,Cities: Skylines is a modern take on the classic city simulation. The game introduces new game play elements to realize the thrill and hardships of creating and maintaining a real city whilst expanding on some well-established tropes of the city building experience.,85
0,107410,"['Single-player', 'Multi-player', 'PvP', 'Online PvP', 'LAN PvP', 'Co-op', 'Online Co-op', 'LAN Co-op', 'Steam Achievements', 'Steam Trading Cards', 'Captions available', 'Steam Workshop', 'Partial Controller Support', 'Steam Leaderboards', 'Includes level editor']",Action,https://cdn.akamai.steamstatic.com/steam/apps/107410/header.jpg?t=1655998601,"Experience true combat gameplay in a massive military sandbox. Deploying a wide variety of single- and multiplayer content, over 20 vehicles and 40 weapons, and limitless opportunities for content creation, this is the PC’s premier military game. Authentic, diverse, open - Arma 3 sends you to war.",74
0,292030,"['Single-player', 'Steam Achievements', 'Full controller support', 'Steam Trading Cards', 'Steam Cloud', 'Remote Play on Tablet', 'Remote Play on TV']",RPG,https://cdn.akamai.steamstatic.com/steam/apps/292030/header.jpg?t=1646996408,"As war rages on throughout the Northern Realms, you take on the greatest contract of your life — tracking down the Child of Prophecy, a living weapon that can alter the shape of the world.",93
0,1158310,"['Single-player', 'Multi-player', 'PvP', 'Online PvP', 'Steam Achievements', 'Steam Trading Cards', 'Steam Workshop', 'Steam Cloud', 'Remote Play on Tablet']",RPG,https://cdn.akamai.steamstatic.com/steam/apps/1158310/header.jpg?t=1655466184,"Love, fight, scheme, and claim greatness. Determine your noble house’s legacy in the sprawling grand strategy of Crusader Kings III. Death is only the beginning as you guide your dynasty’s bloodline in the rich and larger-than-life simulation of the Middle Ages.",91
0,386360,"['Multi-player', 'Steam Achievements', 'Full controller support', 'Steam Trading Cards']",Action,https://cdn.akamai.steamstatic.com/steam/apps/386360/header.jpg?t=1657723612,"Join 35+ million players in SMITE, the Battleground of the Gods! Wield Thor’s hammer, turn your foes to stone as Medusa, or flex your divine power as one of 100+ other mythological icons. Become a God and play FREE today!",83
0,813780,"['Single-player', 'Multi-player', 'PvP', 'Online PvP', 'LAN PvP', 'Co-op', 'Online Co-op', 'LAN Co-op', 'Cross-Platform Multiplayer', 'Steam Achievements', 'Steam Trading Cards', 'Steam Cloud', 'Includes level editor']",Strategy,https://cdn.akamai.steamstatic.com/steam/apps/813780/header.jpg?t=1655752709,"Age of Empires II: Definitive Edition features “The Last Khans” with 3 new campaigns and 4 new Civilizations. Frequent updates include events, additional content, new game modes, and enhanced features with the recent addition of Co-Op mode!",84
0,1172620,"['Multi-player', 'PvP', 'Online PvP', 'Co-op', 'Online Co-op', 'Cross-Platform Multiplayer', 'Steam Achievements', 'Steam Trading Cards', 'In-App Purchases', 'Partial Controller Support', 'Remote Play on Phone', 'Remote Play on Tablet']",Action,https://cdn.akamai.steamstatic.com/steam/apps/1172620/header.jpg?t=1656604686,"Sea of Thieves offers the essential pirate experience, from sailing and fighting to exploring and looting – everything you need to live the pirate life and become a legend in your own right. With no set roles, you have complete freedom to approach the world, and other players, however you choose.",
0,281990,"['Single-player', 'Multi-player', 'Cross-Platform Multiplayer', 'Steam Achievements', 'Steam Trading Cards', 'Steam Workshop', 'Steam Cloud']",Simulation,https://cdn.akamai.steamstatic.com/steam/apps/281990/header.jpg?t=1656004728,"Explore a galaxy full of wonders in this sci-fi grand strategy game from Paradox Development Studios. Interact with diverse alien races, discover strange new worlds with unexpected events and expand the reach of your empire. Each new adventure holds almost limitless possibilities.",78
0,261550,"['Single-player', 'Multi-player', 'PvP', 'Online PvP', 'Partial Controller Support', 'Steam Cloud', 'Remote Play on Tablet']",Action,https://cdn.akamai.steamstatic.com/steam/apps/261550/header.jpg?t=1641803125,"The horns sound, the ravens gather. An empire is torn by civil war. Beyond its borders, new kingdoms rise. Gird on your sword, don your armour, summon your followers and ride forth to win glory on the battlefields of Calradia. Establish your hegemony and create a new world out of the ashes of the old.",
0,739630,"['Single-player', 'Multi-player', 'Co-op', 'Online Co-op', 'Full controller support', 'Steam Cloud', 'Remote Play on Phone', 'Remote Play on Tablet']",Action,https://cdn.akamai.steamstatic.com/steam/apps/739630/header.jpg?t=1654873567,Phasmophobia is a 4 player online co-op psychological horror. Paranormal activity is on the rise and it’s up to you and your team to use all the ghost hunting equipment at your disposal in order to gather as much evidence as you can.,
0,238960,"['Single-player', 'Multi-player', 'MMO', 'PvP', 'Online PvP', 'Co-op', 'Steam Achievements', 'Full controller support', 'Steam Trading Cards', 'In-App Purchases', 'Remote Play on Tablet']",Action,https://cdn.akamai.steamstatic.com/steam/apps/238960/header.jpg?t=1652469162,"You are an Exile, struggling to survive on the dark continent of Wraeclast, as you fight to earn power that will allow you to exact your revenge against those who wronged you. Created by hardcore gamers, Path of Exile is an online Action RPG set in a dark fantasy world.",86
0,594570,"['Single-player', 'Multi-player', 'PvP', 'Online PvP', 'LAN PvP', 'Co-op', 'Online Co-op', 'LAN Co-op', 'Steam Achievements', 'Steam Trading Cards', 'Steam Workshop', 'Remote Play on Tablet']",Action,https://cdn.akamai.steamstatic.com/steam/apps/594570/header.jpg?t=1644489785,"Strategy gaming perfected. A breath-taking campaign of exploration, expansion and conquest across a fantasy world. Turn-based civilisation management and real-time epic strategy battles with thousands of troops and monsters at your command.",87
0,526870,"['Single-player', 'Multi-player', 'Co-op', 'Online Co-op', 'Cross-Platform Multiplayer', 'Steam Cloud', 'Remote Play on Tablet']",Adventure,https://cdn.akamai.steamstatic.com/steam/apps/526870/header.jpg?t=1657895195,"Satisfactory is a first-person open-world factory building game with a dash of exploration and combat. Play alone or with friends, explore an alien planet, create multi-story factories, and enter conveyor belt heaven!",
0,594650,"['Multi-player', 'PvP', 'Online PvP', 'Co-op', 'Online Co-op', 'Steam Achievements', 'Full controller support', 'Steam Trading Cards', 'In-App Purchases', 'Steam Leaderboards', 'Remote Play on Tablet', 'Remote Play on TV']",Action,https://cdn.akamai.steamstatic.com/steam/apps/594650/header.jpg?t=1657795707,"Hunt: Showdown is a high-stakes, tactical PvPvE first-person shooter. Hunt for bounties in the infested Bayou, kill nightmarish monsters and outwit competing hunters - alone or in a group - with your glory, gear, and gold on the line.",81
0,1063730,"['Multi-player', 'MMO', 'PvP', 'Online PvP', 'Co-op', 'Online Co-op', 'Steam Achievements', 'In-App Purchases']",Action,https://cdn.akamai.steamstatic.com/steam/apps/1063730/header.jpg?t=1653580979,"Explore a thrilling, open-world MMO filled with danger and opportunity where you'll forge a new destiny on the supernatural island of Aeternum.",70
0,582660,"['Multi-player', 'MMO', 'PvP', 'Online PvP', 'Co-op', 'Online Co-op', 'Steam Trading Cards', 'In-App Purchases', 'Partial Controller Support']",Action,https://cdn.akamai.steamstatic.com/steam/apps/582660/header.jpg?t=1658233501,"Played by over 20 million Adventurers - Black Desert Online is an open-world, action MMORPG. Experience intense, action-packed combat, battle massive world bosses, fight alongside friends to siege and conquer castles, and train in professions such as fishing, trading, crafting, cooking, and more!",73
0,1604030,"['Single-player', 'Multi-player', 'PvP', 'Online PvP', 'LAN PvP', 'Co-op', 'Online Co-op', 'LAN Co-op']",Action,https://cdn.akamai.steamstatic.com/steam/apps/1604030/header.jpg?t=1655371713,Awaken as a vampire. Hunt for blood in nearby settlements to regain your strength and evade the scorching sun to survive. Raise your castle and thrive in an ever-changing open world full of mystery. Gain allies online and conquer the land of the living.,
0,427520,"['Single-player', 'Multi-player', 'Co-op', 'Online Co-op', 'LAN Co-op', 'Cross-Platform Multiplayer', 'Steam Achievements', 'Steam Cloud', 'Includes level editor', 'Remote Play on Tablet']",Casual,https://cdn.akamai.steamstatic.com/steam/apps/427520/header.jpg?t=1620730652,"Factorio is a game about building and creating automated factories to produce items of increasing complexity, within an infinite 2D world. Use your imagination to design your factory, combine simple elements into ingenious structures, and finally protect it from the creatures who don't really like you.",90
0,250900,"['Single-player', 'Multi-player', 'Shared/Split Screen', 'Steam Achievements', 'Full controller support', 'Steam Trading Cards', 'Steam Cloud', 'Remote Play on TV', 'Remote Play Together']",Action,https://cdn.akamai.steamstatic.com/steam/apps/250900/header.jpg?t=1617174663,"The Binding of Isaac: Rebirth is a randomly generated action RPG shooter with heavy Rogue-like elements. Following Isaac on his journey players will find bizarre treasures that change Isaac’s form giving him super human abilities and enabling him to fight off droves of mysterious creatures, discover secrets and fight his way to safety.",
0,291550,"['Single-player', 'Multi-player', 'PvP', 'Online PvP', 'Shared/Split Screen PvP', 'Co-op', 'Online Co-op', 'Shared/Split Screen Co-op', 'Shared/Split Screen', 'Cross-Platform Multiplayer', 'Steam Achievements', 'Full controller support', 'Steam Trading Cards', 'Remote Play on Phone', 'Remote Play on Tablet', 'Remote Play on TV', 'Remote Play Together']",Action,https://cdn.akamai.steamstatic.com/steam/apps/291550/header.jpg?t=1656346741,"An epic platform fighter for up to 8 players online or local. Try casual free-for-alls, ranked matches, or invite friends to a private room. And it's free! Play cross-platform with millions of players on PlayStation, Xbox, Nintendo Switch, iOS, Android &amp; Steam! Frequent updates. Over fifty Legends.",
0,1091500,"['Single-player', 'Steam Achievements', 'Steam Trading Cards', 'Partial Controller Support', 'Steam Cloud']",RPG,https://cdn.akamai.steamstatic.com/steam/apps/1091500/header.jpg?t=1649065890,"Cyberpunk 2077 is an open-world, action-adventure RPG set in the dark future of Night City — a dangerous megalopolis obsessed with power, glamor, and ceaseless body modification.",86
0,960090,"['Single-player', 'Multi-player', 'Co-op', 'Online Co-op', 'Steam Achievements', 'In-App Purchases', 'Remote Play on Phone', 'Remote Play on Tablet']",Strategy,https://cdn.akamai.steamstatic.com/steam/apps/960090/header.jpg?t=1634303522,The Bloons are back and better than ever! Get ready for a massive 3D tower defense game designed to give you hours and hours of the best strategy gaming available.,
0,1468810,"['Single-player', 'Steam Achievements', 'Steam Workshop', 'Steam Cloud', 'Remote Play on Tablet']",Action,https://cdn.akamai.steamstatic.com/steam/apps/1468810/header.jpg?t=1656671880,"Tale of Immortal is an open-world sandbox based on Chinese mythology and cultivation. You will grow to become immortal, conquer the beasts from the Classic of Mountains and Season, make your choices carefully and grasp your own destiny.",
0,868270,"['Multi-player', 'PvP', 'Online PvP', 'Co-op', 'Online Co-op', 'In-App Purchases']",Action,https://cdn.akamai.steamstatic.com/steam/apps/868270/header.jpg?t=1656338699,"The Cycle: Frontier is a free-to-play PvPvE Extraction Shooter driven by suspense and danger. Prospect for resources and other riches on an abandoned alien world ravaged by a deadly storm, inhabited by monsters, and frequently raided by other ambitious Prospectors.",
0,1794680,"['Single-player', 'Steam Achievements', 'Full controller support', 'Steam Cloud']",Action,https://cdn.akamai.steamstatic.com/steam/apps/1794680/header.jpg?t=1657145362,"Mow down thousands of night creatures and survive until dawn! Vampire Survivors is a gothic horror casual game with rogue-lite elements, where your choices can allow you to quickly snowball against the hundreds of monsters that get thrown at you.",
0,629520,,Audio Production,https://cdn.akamai.steamstatic.com/steam/apps/629520/header.jpg?t=1577013777,"Play sounds in voice chats in high digital quality. Add sounds or music to your microphone signal so others will hear it, too.",
0,440900,"['Single-player', 'Multi-player', 'PvP', 'Online PvP', 'Co-op', 'Online Co-op', 'Steam Achievements', 'Full controller support', 'Steam Trading Cards', 'Steam Workshop', 'Remote Play on Tablet', 'Remote Play on TV']",Action,https://cdn.akamai.steamstatic.com/steam/apps/440900/header.jpg?t=1656509325,"An online multiplayer survival game, now with mounts and mounted combat, set in the lands of Conan the Barbarian. Survive in a vast open world sandbox, build a home and kingdom, dominate your enemies in single or multiplayer.",68
0,548430,"['Single-player', 'Multi-player', 'Co-op', 'Online Co-op', 'Steam Achievements', 'Full controller support', 'Steam Trading Cards', 'Captions available', 'Steam Cloud', 'Remote Play on Tablet', 'Remote Play on TV']",Action,https://cdn.akamai.steamstatic.com/steam/apps/548430/header_alt_assets_13.jpg?t=1657021307,"Deep Rock Galactic is a 1-4 player co-op FPS featuring badass space Dwarves, 100% destructible environments, procedurally-generated caves, and endless hordes of alien monsters.",85
0,10,"['Multi-player', 'PvP', 'Online PvP', 'Shared/Split Screen PvP', 'Valve Anti-Cheat enabled']",Action,https://cdn.akamai.steamstatic.com/steam/apps/10/header.jpg?t=1602535893,Play the world's number 1 online action game. Engage in an incredibly realistic brand of terrorist warfare in this wildly popular team-based game. Ally with teammates to complete strategic missions. Take out enemy sites. Rescue hostages. Your role affects your team's success. Your team's success affects your role.,88
0,1454400,"['Single-player', 'Steam Achievements', 'Steam Workshop', 'Steam Cloud']",Casual,https://cdn.akamai.steamstatic.com/steam/apps/1454400/header.jpg?t=1654840309,"An idle game about making cookies! Originally released in 2013 on the web, and actively developed since then. This is the official version for Steam.",
0,1692250,"['Single-player', 'Multi-player', 'PvP', 'Online PvP', 'LAN PvP', 'Shared/Split Screen PvP', 'Co-op', 'Online Co-op', 'LAN Co-op', 'Shared/Split Screen', 'Steam Achievements', 'Steam Workshop', 'In-App Purchases', 'Partial Controller Support', 'Steam Cloud', 'Remote Play Together']",Racing,https://cdn.akamai.steamstatic.com/steam/apps/1692250/header.jpg?t=1658163613,Enter the new era of Formula 1® in EA SPORTS™ F1® 22 the official videogame of the 2022 FIA Formula One World Championship™.,
0,1238810,"['Single-player', 'Multi-player', 'PvP', 'Online PvP', 'Steam Achievements', 'Full controller support', 'Steam Trading Cards']",Action,https://cdn.akamai.steamstatic.com/steam/apps/1238810/header.jpg?t=1641312066,"This is the ultimate Battlefield V experience. Enter mankind’s greatest conflict with the complete arsenal of weapons, vehicles, and gadgets plus the best customization content of Year 1 and 2.",
0,513710,"['Single-player', 'Multi-player', 'MMO', 'PvP', 'Online PvP', 'Co-op', 'Online Co-op', 'Steam Achievements', 'Steam Trading Cards', 'Stats']",Action,https://cdn.akamai.steamstatic.com/steam/apps/513710/header.jpg?t=1656592082,"SCUM aims to evolve the multiplayer open world survival game with unprecedented levels of character customization, control and progression, where knowledge and skills are the ultimate weapons for long-term survival.",
0,242760,"['Single-player', 'Multi-player', 'Co-op', 'Online Co-op', 'LAN Co-op', 'Partial Controller Support', 'Steam Cloud']",Action,https://cdn.akamai.steamstatic.com/steam/apps/242760/header.jpg?t=1590522045,"As the lone survivor of a passenger jet crash, you find yourself in a mysterious forest battling to stay alive against a society of cannibalistic mutants. Build, explore, survive in this terrifying first person survival horror simulator.",83
0,552990,"['Multi-player', 'MMO', 'PvP', 'Online PvP', 'Co-op', 'Online Co-op', 'Steam Achievements', 'Steam Trading Cards', 'In-App Purchases', 'Steam Cloud']",Action,https://cdn.akamai.steamstatic.com/steam/apps/552990/header.jpg?t=1657810848,"Immerse yourself in thrilling naval battles and assemble an armada of over 400 ships from the first half of the 20th century — from stealthy destroyers to gigantic battleships. Change the look of your ship, choose upgrades to suit your play style, and go into battle with other players!",81
0,646570,"['Single-player', 'Steam Achievements', 'Full controller support', 'Steam Trading Cards', 'Steam Workshop', 'Steam Cloud', 'Stats', 'Steam Leaderboards', 'Remote Play on Phone', 'Remote Play on Tablet', 'Remote Play on TV']",Indie,https://cdn.akamai.steamstatic.com/steam/apps/646570/header.jpg?t=1592339399,"We fused card games and roguelikes together to make the best single player deckbuilder we could. Craft a unique deck, encounter bizarre creatures, discover relics of immense power, and Slay the Spire!",89
0,435150,"['Single-player', 'Multi-player', 'PvP', 'Online PvP', 'Shared/Split Screen PvP', 'Co-op', 'Online Co-op', 'Shared/Split Screen Co-op', 'Shared/Split Screen', 'Steam Achievements', 'Full controller support', 'Steam Trading Cards', 'Captions available', 'Steam Workshop', 'Steam Cloud', 'Includes level editor', 'Remote Play on Tablet', 'Remote Play on TV', 'Remote Play Together']",Adventure,https://cdn.akamai.steamstatic.com/steam/apps/435150/header.jpg?t=1631177562,"The critically acclaimed RPG that raised the bar, from the creators of Baldur's Gate 3. Gather your party. Master deep, tactical combat. Venture as a party of up to four - but know that only one of you will have the chance to become a God.",93
0,1263850,"['Single-player', 'Multi-player', 'Steam Achievements', 'Steam Cloud']",Simulation,https://cdn.akamai.steamstatic.com/steam/apps/1263850/header.jpg?t=1649698124,"New additions and game upgrades deliver added levels of depth, drama and football authenticity. FM21 empowers you like never before to develop your skills and command success at your club.",
0,1151340,"['Multi-player', 'MMO', 'PvP', 'Online PvP', 'Co-op', 'Online Co-op', 'Steam Achievements', 'In-App Purchases', 'Partial Controller Support', 'Remote Play on Tablet']",RPG,https://cdn.akamai.steamstatic.com/steam/apps/1151340/header.jpg?t=1655228843,"Bethesda Game Studios welcome you to Fallout 76. Twenty-five years after the bombs fall, you and your fellow Vault Dwellers emerge into post-nuclear America. Explore a vast wasteland in this open-world multiplayer addition to the Fallout story.",
0,361420,"['Single-player', 'Multi-player', 'Co-op', 'Online Co-op', 'Steam Achievements', 'Full controller support', 'Steam Cloud', 'Remote Play on Tablet', 'Remote Play on TV']",Adventure,https://cdn.akamai.steamstatic.com/steam/apps/361420/header_alt_assets_9.jpg?t=1656698434,A game of aerospace industry and interplanetary exploration.,
0,275850,"['Single-player', 'Multi-player', 'PvP', 'Online PvP', 'Co-op', 'Online Co-op', 'Steam Achievements', 'Full controller support', 'Steam Cloud', 'Remote Play on Tablet', 'Remote Play on TV']",Action,https://cdn.akamai.steamstatic.com/steam/apps/275850/header.jpg?t=1653577357,No Man's Sky is a game about exploration and survival in an infinite procedurally generated universe.,61
0,393380,"['Multi-player', 'PvP', 'Online PvP', 'Steam Trading Cards', 'Steam Workshop', 'Partial Controller Support', 'Valve Anti-Cheat enabled']",Action,https://cdn.akamai.steamstatic.com/steam/apps/393380/header.jpg?t=1656008014,"Squad is a tactical FPS that provides authentic combat experiences through teamwork, constant communication, and realistic gameplay. It bridges the gap between arcade shooter and military simulation with 100 player battles, combined arms combat, base building, and an integrated VoIP system.",
0,284160,"['Single-player', 'Steam Achievements', 'Steam Trading Cards', 'Partial Controller Support', 'Steam Cloud', 'Includes level editor', 'Remote Play on Phone', 'Remote Play on Tablet', 'Remote Play Together']",Racing,https://cdn.akamai.steamstatic.com/steam/apps/284160/header.jpg?t=1655290741,A dynamic soft-body physics vehicle simulator capable of doing just about anything.,
0,1118200,"['Single-player', 'Steam Achievements', 'Steam Trading Cards', 'Steam Workshop', 'Steam Cloud']",Action,https://cdn.akamai.steamstatic.com/steam/apps/1118200/header.jpg?t=1649350842,"Shoot, stab, burn, poison, tear, vaporise, or crush ragdolls in a large open space.",
0,1142710,"['Single-player', 'Multi-player', 'PvP', 'Online PvP', 'LAN PvP', 'Co-op', 'Online Co-op', 'LAN Co-op', 'Steam Achievements', 'Steam Trading Cards']",Action,https://cdn.akamai.steamstatic.com/steam/apps/1142710/header.jpg?t=1655373508,"The cataclysmic conclusion to the Total War: WARHAMMER trilogy is here. Rally your forces and step into the Realm of Chaos, a dimension of mind-bending horror where the very fate of the world will be decided. Will you conquer your Daemons… or command them?",86
0,632360,"['Single-player', 'Multi-player', 'PvP', 'Online PvP', 'Co-op', 'Online Co-op', 'Full controller support', 'Steam Cloud', 'Steam Leaderboards', 'Remote Play on Phone', 'Remote Play on Tablet', 'Remote Play on TV']",Action,https://cdn.akamai.steamstatic.com/steam/apps/632360/header.jpg?t=1657821925,"Escape a chaotic alien planet by fighting through hordes of frenzied monsters – with your friends, or on your own. Combine loot in surprising ways and master each character until you become the havoc you feared upon your first crash landing.",85
0,1290000,"['Single-player', 'Multi-player', 'Co-op', 'Online Co-op', 'Cross-Platform Multiplayer', 'Full controller support', 'Steam Cloud']",Casual,https://cdn.akamai.steamstatic.com/steam/apps/1290000/header.jpg?t=1658154399,"Release the Pressure with PowerWash Simulator! Wash away your worries with the soothing sounds of high-pressure water. Fire up your power washer and blast away every speck of dirt and grime you can find, all with the simple satisfaction of power-washing to a sparkling finish.",
0,457140,"['Single-player', 'Steam Trading Cards']",Indie,https://cdn.akamai.steamstatic.com/steam/apps/457140/header_alt_assets_6.jpg?t=1654189805,"Oxygen Not Included is a space-colony simulation game. Deep inside an alien space rock your industrious crew will need to master science, overcome strange new lifeforms, and harness incredible space tech to survive, and possibly, thrive.",86
0,322170,"['Single-player', 'Steam Achievements', 'Steam Trading Cards', 'Partial Controller Support', 'Includes level editor', 'Remote Play on Phone', 'Remote Play on Tablet']",Action,https://cdn.akamai.steamstatic.com/steam/apps/322170/header.jpg?t=1624472273,Jump and fly your way through danger in this rhythm-based action platformer!,
0,1551360,"['Single-player', 'Multi-player', 'PvP', 'Online PvP', 'Co-op', 'Online Co-op', 'Cross-Platform Multiplayer', 'Steam Achievements', 'Full controller support', 'Steam Trading Cards', 'Steam Cloud']",Action,https://cdn.akamai.steamstatic.com/steam/apps/1551360/header.jpg?t=1656026814,"Blast off to the visually stunning, exhilarating Horizon Hot Wheels Park in the clouds high above Mexico. Race 10 amazing new cars on the fastest, most extreme tracks ever devised. Design, build, and share your own Hot Wheels adventure. Requires Forza Horizon 5 game, sold separately",
