,steam_appid,categories,genres,header_image,short_description,meta
0,730,"['Multi-player', 'Steam Achievements', 'Full controller support', 'Steam Trading Cards', 'Steam Workshop', 'In-App Purchases', 'Valve Anti-Cheat enabled', 'Stats', 'Remote Play on Phone', 'Remote Play on Tablet', 'Remote Play on TV']",Action,https://cdn.akamai.steamstatic.com/steam/apps/730/header.jpg?t=1641233427,"Counter-Strike: Global Offensive (CS: GO) expands upon the team-based action gameplay that it pioneered when it was launched 19 years ago. CS: GO features new maps, characters, weapons, and game modes, and delivers updated versions of the classic CS content (de_dust2, etc.).",83
0,570,"['Multi-player', 'Co-op', 'Steam Trading Cards', 'Steam Workshop', 'SteamVR Collectibles', 'In-App Purchases', 'Valve Anti-Cheat enabled']",Action,https://cdn.akamai.steamstatic.com/steam/apps/570/header.jpg?t=1650611880,"Every day, millions of players worldwide enter battle as one of over a hundred Dota heroes. And no matter if it's their 10th hour of play or 1,000th, there's always something new to discover. With regular updates that ensure a constant evolution of gameplay, features, and heroes, Dota 2 has taken on a life of its own.",90
0,578080,"['Multi-player', 'PvP', 'Online PvP', 'Stats', 'Remote Play on Phone', 'Remote Play on Tablet']",Action,https://cdn.akamai.steamstatic.com/steam/apps/578080/header.jpg?t=1657765663,"Play PUBG: BATTLEGROUNDS for free. Land on strategic locations, loot weapons and supplies, and survive to become the last team standing across various, diverse Battlegrounds. Squad up and join the Battlegrounds for the original Battle Royale experience that only PUBG: BATTLEGROUNDS can offer.",
0,1172470,"['Multi-player', 'PvP', 'Online PvP', 'Co-op', 'Online Co-op', 'Steam Achievements', 'Full controller support', 'Steam Trading Cards', 'In-App Purchases']",Action,https://cdn.akamai.steamstatic.com/steam/apps/1172470/header.jpg?t=1657217209,"Apex Legends is the award-winning, free-to-play Hero Shooter from Respawn Entertainment. Master an ever-growing roster of legendary characters with powerful abilities, and experience strategic squad play and innovative gameplay in the next evolution of Hero Shooter and Battle Royale.",88
0,,,,,,
0,1446780,"['Single-player', 'Multi-player', 'Co-op', 'Online Co-op', 'Steam Achievements', 'Full controller support', 'Steam Trading Cards', 'Steam Cloud']",Action,https://cdn.akamai.steamstatic.com/steam/apps/1446780/header.jpg?t=1656665891,"Rise to the challenge and join the hunt! In Monster Hunter Rise, the latest installment in the award-winning and top-selling Monster Hunter series, you’ll become a hunter, explore brand new maps and use a variety of weapons to take down fearsome monsters as part of an all-new storyline.",87
0,271590,"['Single-player', 'Multi-player', 'PvP', 'Online PvP', 'Co-op', 'Online Co-op', 'Steam Achievements', 'Full controller support', 'Remote Play on Phone', 'Remote Play on Tablet', 'Remote Play on TV']",Action,https://cdn.akamai.steamstatic.com/steam/apps/271590/header.jpg?t=1618856444,"Grand Theft Auto V for PC offers players the option to explore the award-winning world of Los Santos and Blaine County in resolutions of up to 4k and beyond, as well as the chance to experience the game running at 60 frames per second.",96
0,440,"['Multi-player', 'Cross-Platform Multiplayer', 'Steam Achievements', 'Steam Trading Cards', 'Captions available', 'Steam Workshop', 'In-App Purchases', 'Partial Controller Support', 'Valve Anti-Cheat enabled', 'Stats', 'Includes level editor', 'Commentary available', 'Remote Play on Phone', 'Remote Play on Tablet']",Action,https://cdn.akamai.steamstatic.com/steam/apps/440/header.jpg?t=1592263852,"Nine distinct classes provide a broad range of tactical abilities and personalities. Constantly updated with new game modes, maps, equipment and, most importantly, hats!",92
0,346110,"['Single-player', 'Multi-player', 'MMO', 'Co-op', 'Steam Achievements', 'Full controller support', 'Steam Workshop', 'Steam Cloud', 'Valve Anti-Cheat enabled', 'Includes level editor', 'Remote Play on Tablet']",Action,https://cdn.akamai.steamstatic.com/steam/apps/346110/header.jpg?t=1655137924,"Stranded on the shores of a mysterious island, you must learn to survive. Use your cunning to kill or tame the primeval creatures roaming the land, and encounter other players to survive, dominate... and escape!",70
0,252490,"['Multi-player', 'MMO', 'PvP', 'Online PvP', 'Co-op', 'Online Co-op', 'Cross-Platform Multiplayer', 'Steam Achievements', 'Steam Trading Cards', 'Steam Workshop', 'In-App Purchases', 'Valve Anti-Cheat enabled', 'Stats', 'Remote Play on Tablet']",Action,https://cdn.akamai.steamstatic.com/steam/apps/252490/header.jpg?t=1656003795,"The only aim in Rust is to survive. Everything wants you to die - the island’s wildlife and other inhabitants, the environment, other survivors. Do whatever it takes to last another night.",69
0,431960,"['Steam Achievements', 'Steam Trading Cards', 'Steam Workshop', 'Steam Workshop', 'Includes level editor']",Casual,https://cdn.akamai.steamstatic.com/steam/apps/431960/header.jpg?t=1637933048,Use stunning live wallpapers on your desktop. Animate your own images to create new wallpapers or import videos/websites and share them on the Steam Workshop!,
0,230410,"['Single-player', 'Multi-player', 'Co-op', 'Online Co-op', 'Steam Achievements', 'Full controller support', 'Steam Trading Cards', 'Steam Workshop', 'In-App Purchases', 'Remote Play on Phone', 'Remote Play on Tablet']",Action,https://cdn.akamai.steamstatic.com/steam/apps/230410/header.jpg?t=1658079532,Awaken as an unstoppable warrior and battle alongside your friends in this story-driven free-to-play online action game,69
0,1506830,"['Single-player', 'Multi-player', 'MMO', 'PvP', 'Online PvP', 'Shared/Split Screen PvP', 'Co-op', 'Online Co-op', 'Shared/Split Screen Co-op', 'Shared/Split Screen', 'Steam Achievements', 'In-App Purchases', 'Partial Controller Support']",Simulation,https://cdn.akamai.steamstatic.com/steam/apps/1506830/header.jpg?t=1653581021,"Powered by Football™, EA SPORTS™ FIFA 22 brings the game even closer to the real thing with fundamental gameplay advances and a new season of innovation across every mode.",
0,1203220,"['Multi-player', 'PvP', 'Online PvP', 'In-App Purchases', 'Partial Controller Support']",Action,https://cdn.akamai.steamstatic.com/steam/apps/1203220/header.jpg?t=1655953882,"NARAKA: BLADEPOINT is an up to 60-player PVP mythical action combat experience with martial arts inspired melee combat, gravity defying mobility, vast arsenals of melee &amp; ranged weapons, legendary customizable heroes with epic abilities - inspired by the legends of the Far East.",71
0,1569040,"['Single-player', 'Multi-player', 'Steam Achievements', 'Steam Cloud']",Simulation,https://cdn.akamai.steamstatic.com/steam/apps/1569040/header.jpg?t=1649351903,"The closest thing to real football management. FM22 brings new, progressive ways to find your winning edge, instill your footballing style and earn it on the pitch.",
0,1085660,"['Single-player', 'Multi-player', 'PvP', 'Online PvP', 'Co-op', 'Online Co-op', 'Steam Achievements', 'Full controller support', 'In-App Purchases', 'Remote Play on Phone', 'Remote Play on Tablet', 'Remote Play on TV']",Action,https://cdn.akamai.steamstatic.com/steam/apps/1085660/header.jpg?t=1657835870,"Destiny 2 is an action MMO with a single evolving world that you and your friends can join anytime, anywhere, absolutely free.",83
0,304930,"['Single-player', 'Multi-player', 'PvP', 'Online PvP', 'LAN PvP', 'Co-op', 'Online Co-op', 'LAN Co-op', 'Steam Achievements', 'Steam Trading Cards', 'Steam Workshop', 'In-App Purchases', 'Steam Cloud', 'Valve Anti-Cheat enabled', 'Stats', 'Includes level editor', 'Remote Play on Tablet']",Action,https://cdn.akamai.steamstatic.com/steam/apps/304930/header.jpg?t=1642457764,"You're a survivor in the zombie infested ruins of society, and must work with your friends and forge alliances to remain among the living.",
0,236390,"['Single-player', 'Multi-player', 'MMO', 'PvP', 'Online PvP', 'Co-op', 'Online Co-op', 'Cross-Platform Multiplayer', 'Steam Achievements', 'Full controller support', 'In-App Purchases', 'Remote Play on Phone', 'Remote Play on Tablet']",Action,https://cdn.akamai.steamstatic.com/steam/apps/236390/header.jpg?t=1657292099,"War Thunder is the most comprehensive free-to-play, cross-platform, MMO military game dedicated to aviation, armoured vehicles, and naval craft, from the early 20th century to the most advanced modern combat units. Join now and take part in major battles on land, in the air, and at sea.",81
0,648800,"['Single-player', 'Multi-player', 'Co-op', 'Online Co-op', 'Steam Achievements', 'Steam Cloud']",Adventure,https://cdn.akamai.steamstatic.com/steam/apps/648800/header.jpg?t=1655744208,"Raft throws you and your friends into an epic oceanic adventure! Alone or together, players battle to survive a perilous voyage across a vast sea! Gather debris, scavenge reefs and build your own floating home, but be wary of the man-eating sharks!",
0,413150,"['Single-player', 'Multi-player', 'Co-op', 'Online Co-op', 'LAN Co-op', 'Shared/Split Screen Co-op', 'Shared/Split Screen', 'Steam Achievements', 'Full controller support', 'Steam Trading Cards', 'Steam Cloud', 'Remote Play on Phone', 'Remote Play on Tablet', 'Remote Play Together']",Indie,https://cdn.akamai.steamstatic.com/steam/apps/413150/header.jpg?t=1608624324,"You've inherited your grandfather's old farm plot in Stardew Valley. Armed with hand-me-down tools and a few coins, you set out to begin your new life. Can you learn to live off the land and turn these overgrown fields into a thriving home?",89
0,1245620,"['Single-player', 'Multi-player', 'PvP', 'Online PvP', 'Co-op', 'Online Co-op', 'Steam Achievements', 'Full controller support', 'Steam Trading Cards']",Action,https://cdn.akamai.steamstatic.com/steam/apps/1245620/header.jpg?t=1654259241,"THE NEW FANTASY ACTION RPG. Rise, Tarnished, and be guided by grace to brandish the power of the Elden Ring and become an Elden Lord in the Lands Between.",94
0,381210,"['Multijoueur', 'PvP', 'JcJ en ligne', 'Coopération', 'Coopération en ligne', 'Multijoueur multiplateforme', 'Succès Steam', 'Compat. contrôleurs complète', 'Cartes à échanger Steam', 'Steam Cloud', 'Remote Play sur téléphone', 'Remote Play sur tablette', 'Remote Play sur télévision']",Action,https://cdn.akamai.steamstatic.com/steam/apps/381210/header.jpg?t=1654817203,Dead by Daylight est un jeu d’action multi-joueurs (4 contre 1) qui vous plonge dans une ambiance de film d’horreur. Chaque joueur peut jouer le rôle d’un tueur sanguinaire pendant que les quatre autres tentent de lui échapper en évitant d’être attrapé et tué.,
0,359550,"['Single-player', 'Multi-player', 'PvP', 'Online PvP', 'Co-op', 'Online Co-op', 'Steam Trading Cards', 'In-App Purchases', 'Partial Controller Support', 'Remote Play on Phone', 'Remote Play on Tablet']",Action,https://cdn.akamai.steamstatic.com/steam/apps/359550/header.jpg?t=1655223333,Tom Clancy's Rainbow Six Siege is the latest installment of the acclaimed first-person shooter franchise developed by the renowned Ubisoft Montreal studio.,
0,221100,"['Multi-player', 'MMO', 'PvP', 'Online PvP', 'Co-op', 'Online Co-op', 'Steam Achievements', 'Steam Workshop', 'Steam Cloud', 'Valve Anti-Cheat enabled']",Action,https://cdn.akamai.steamstatic.com/steam/apps/221100/header.jpg?t=1658234476,"How long can you survive a post-apocalyptic world? A land overrun with an infected &quot;zombie&quot; population, where you compete with other survivors for limited resources. Will you team up with strangers and stay strong together? Or play as a lone wolf to avoid betrayal? This is DayZ – this is your story.",
0,289070,"['Single-player', 'Multi-player', 'PvP', 'Online PvP', 'LAN PvP', 'Shared/Split Screen PvP', 'Shared/Split Screen', 'Cross-Platform Multiplayer', 'Steam Achievements', 'Steam Trading Cards', 'Steam Workshop', 'Steam Turn Notifications', 'Remote Play on Tablet', 'Remote Play Together']",Strategy,https://cdn.akamai.steamstatic.com/steam/apps/289070/header.jpg?t=1656624374,"Civilization VI is the newest installment in the award winning Civilization Franchise. Expand your empire, advance your culture and go head-to-head against history’s greatest leaders. Will your civilization stand the test of time?",88
0,218620,"['Single-player', 'Multi-player', 'Co-op', 'Online Co-op', 'Steam Achievements', 'Full controller support', 'Steam Trading Cards', 'In-App Purchases', 'Steam Cloud', 'Remote Play on Phone', 'Remote Play on Tablet', 'Remote Play on TV']",Action,https://cdn.akamai.steamstatic.com/steam/apps/218620/header.jpg?t=1657731026,"PAYDAY 2 is an action-packed, four-player co-op shooter that once again lets gamers don the masks of the original PAYDAY crew - Dallas, Hoxton, Wolf and Chains - as they descend on Washington DC for an epic crime spree.",79
0,394360,"['Single-player', 'Multi-player', 'Co-op', 'Cross-Platform Multiplayer', 'Steam Achievements', 'Steam Trading Cards', 'Steam Workshop', 'Steam Cloud', 'Remote Play on Tablet']",Simulation,https://cdn.akamai.steamstatic.com/steam/apps/394360/header.jpg?t=1654610466,"Victory is at your fingertips! Your ability to lead your nation is your supreme weapon, the strategy game Hearts of Iron IV lets you take command of any nation in World War II; the most engaging conflict in world history.",83
0,105600,"['Single-player', 'Multi-player', 'PvP', 'Online PvP', 'Co-op', 'Online Co-op', 'Steam Achievements', 'Full controller support', 'Steam Trading Cards', 'Steam Cloud', 'Remote Play on Phone', 'Remote Play on Tablet', 'Remote Play on TV']",Action,https://cdn.akamai.steamstatic.com/steam/apps/105600/header.jpg?t=1590092560,"Dig, fight, explore, build! Nothing is impossible in this action-packed adventure game. Four Pack also available!",83
0,4000,"['Single-player', 'Multi-player', 'PvP', 'Online PvP', 'LAN PvP', 'Co-op', 'Online Co-op', 'LAN Co-op', 'Cross-Platform Multiplayer', 'Steam Achievements', 'Steam Trading Cards', 'Captions available', 'Steam Workshop', 'Steam Cloud', 'Valve Anti-Cheat enabled', 'Includes level editor', 'Remote Play on Tablet']",Indie,https://cdn.akamai.steamstatic.com/steam/apps/4000/header.jpg?t=1617307042,Garry's Mod is a physics sandbox. There aren't any predefined aims or goals. We give you the tools and leave you to play.,
0,438100,"['Multi-player', 'MMO', 'PvP', 'Online PvP', 'Co-op', 'Online Co-op', 'Cross-Platform Multiplayer', 'Partial Controller Support']",Adventure,https://cdn.akamai.steamstatic.com/steam/apps/438100/header.jpg?t=1648777811,"Join our growing community as you explore, play, and help craft the future of social VR. Create worlds and custom avatars. Welcome to VRChat.",
0,1097150,"['Multi-player', 'MMO', 'PvP', 'Online PvP', 'Co-op', 'Online Co-op', 'Steam Achievements', 'In-App Purchases', 'Partial Controller Support', 'Remote Play on Phone', 'Remote Play on Tablet']",Action,https://cdn.akamai.steamstatic.com/steam/apps/1097150/header.jpg?t=1656022034,"Fall Guys is a free, cross-platform, massively multiplayer, party royale game where you and your fellow contestants compete through escalating rounds of absurd obstacle course chaos until one lucky victor remains!",80
0,39210,"['Single-player', 'Multi-player', 'MMO', 'PvP', 'Online PvP', 'Co-op', 'Online Co-op', 'Cross-Platform Multiplayer', 'Partial Controller Support', 'Remote Play on Tablet']",Massively Multiplayer,https://cdn.akamai.steamstatic.com/steam/apps/39210/header.jpg?t=1646695302,Take part in an epic and ever-changing FINAL FANTASY as you adventure and explore with friends from around the world.,83
0,252950,"['Single-player', 'Multi-player', 'PvP', 'Online PvP', 'Shared/Split Screen PvP', 'Co-op', 'Online Co-op', 'Shared/Split Screen Co-op', 'Shared/Split Screen', 'Cross-Platform Multiplayer', 'Steam Achievements', 'Full controller support', 'Steam Trading Cards', 'Steam Workshop', 'Steam Cloud', 'Stats', 'Remote Play on Phone', 'Remote Play on Tablet', 'Remote Play on TV', 'Remote Play Together']",Action,https://cdn.akamai.steamstatic.com/steam/apps/252950/header.jpg?t=1655312496,"Rocket League is a high-powered hybrid of arcade-style soccer and vehicular mayhem with easy-to-understand controls and fluid, physics-driven competition. Rocket League includes casual and competitive Online Matches, a fully-featured offline Season Mode, special “Mutators” that let you change the rules entirely, hockey and...",86
0,227300,"['Jednoosobowa', 'Wieloosobowa', 'Kooperacja', 'Sieciowa kooperacja', 'Osiągnięcia Steam', 'Karty kolekcjonerskie Steam', 'Warsztat Steam', 'Częściowa obsługa kontrolerów', 'Steam Cloud', 'Zawiera edytor poziomów', 'Remote Play na telefonie', 'Remote Play na tablecie', 'Remote Play Together']",Niezależne,https://cdn.akamai.steamstatic.com/steam/apps/227300/header.jpg?t=1656428921,"Travel across Europe as king of the road, a trucker who delivers important cargo across impressive distances! With dozens of cities to explore, your endurance, skill and speed will all be pushed to their limits.",79
0,489830,"['Single-player', 'Steam Achievements', 'Partial Controller Support', 'Steam Cloud', 'Remote Play on Phone', 'Remote Play on Tablet']",RPG,https://cdn.akamai.steamstatic.com/steam/apps/489830/header.jpg?t=1650909796,"Winner of more than 200 Game of the Year Awards, Skyrim Special Edition brings the epic fantasy to life in stunning detail. The Special Edition includes the critically acclaimed game and add-ons with all-new features like remastered art and effects, volumetric god rays, dynamic depth of field, screen-space reflections, and more.",74
0,1644960,"['Single-player', 'Multi-player', 'PvP', 'Online PvP', 'Shared/Split Screen PvP', 'Co-op', 'Online Co-op', 'Shared/Split Screen Co-op', 'Shared/Split Screen', 'Steam Achievements', 'Full controller support', 'In-App Purchases', 'Steam Cloud', 'Remote Play on Tablet', 'Remote Play Together']",Simulation,https://cdn.akamai.steamstatic.com/steam/apps/1644960/header.jpg?t=1656687987,"NBA 2K22 puts the entire basketball universe in your hands. Anyone, anywhere can hoop in NBA 2K22.",
0,1248130,"['Single-player', 'Multi-player', 'Co-op', 'Online Co-op', 'Cross-Platform Multiplayer', 'Steam Achievements', 'Full controller support', 'Steam Trading Cards', 'Steam Cloud', 'Remote Play on TV']",Simulation,https://cdn.akamai.steamstatic.com/steam/apps/1248130/header.jpg?t=1656710454,"Create your farm and let the good times grow! Harvest crops, tend to animals, manage productions, and take on seasonal challenges.",
0,444200,"['Multi-player', 'MMO', 'PvP', 'Online PvP', 'Co-op', 'Online Co-op', 'Cross-Platform Multiplayer', 'Steam Trading Cards', 'In-App Purchases']",Action,https://cdn.akamai.steamstatic.com/steam/apps/444200/header.jpg?t=1657792741,"All month long, participate in events and follow the heroes of the Once Upon a Time in July comics!",
0,251570,"['Single-player', 'Multi-player', 'PvP', 'Online PvP', 'LAN PvP', 'Co-op', 'Online Co-op', 'LAN Co-op', 'Cross-Platform Multiplayer', 'Steam Achievements', 'Full controller support', 'Steam Trading Cards', 'Includes level editor', 'Remote Play on Tablet', 'Remote Play on TV']",Action,https://cdn.akamai.steamstatic.com/steam/apps/251570/header.jpg?t=1650477344,"7 Days to Die is an open-world game that is a unique combination of first-person shooter, survival horror, tower defense, and role-playing games. Play the definitive zombie survival sandbox RPG that came first. Navezgane awaits!",
0,322330,"['Single-player', 'Multi-player', 'PvP', 'Online PvP', 'LAN PvP', 'Co-op', 'Online Co-op', 'LAN Co-op', 'Full controller support', 'Steam Trading Cards', 'Steam Workshop', 'In-App Purchases', 'Remote Play on Phone', 'Remote Play on Tablet', 'Remote Play on TV']",Adventure,https://cdn.akamai.steamstatic.com/steam/apps/322330/header_alt_assets_31.jpg?t=1656607265,"Fight, Farm, Build and Explore Together in the standalone multiplayer expansion to the uncompromising wilderness survival game, Don't Starve.",83
0,108600,"['Single-player', 'Multi-player', 'PvP', 'Online PvP', 'Co-op', 'Online Co-op', 'Shared/Split Screen Co-op', 'Shared/Split Screen', 'Cross-Platform Multiplayer', 'Steam Trading Cards', 'Partial Controller Support', 'Remote Play Together']",Indie,https://cdn.akamai.steamstatic.com/steam/apps/108600/header.jpg?t=1655867638,"Project Zomboid is the ultimate in zombie survival. Alone or in MP: you loot, build, craft, fight, farm and fish in a struggle to survive. A hardcore RPG skillset, a vast map, massively customisable sandbox and a cute tutorial raccoon await the unwary. So how will you die? All it takes is a bite..",
0,294100,"['Single-player', 'Steam Workshop', 'Steam Cloud', 'Remote Play on Tablet']",Indie,https://cdn.akamai.steamstatic.com/steam/apps/294100/header.jpg?t=1650485223,"A sci-fi colony sim driven by an intelligent AI storyteller. Generates stories by simulating psychology, ecology, gunplay, melee combat, climate, biomes, diplomacy, interpersonal relationships, art, medicine, trade, and more.",87
0,1174180,"['Single-player', 'Multi-player', 'PvP', 'Online PvP', 'Co-op', 'Online Co-op', 'Steam Achievements', 'In-App Purchases', 'Partial Controller Support', 'Remote Play on Phone', 'Remote Play on Tablet']",Action,https://cdn.akamai.steamstatic.com/steam/apps/1174180/header.jpg?t=1656615305,"Winner of over 175 Game of the Year Awards and recipient of over 250 perfect scores, RDR2 is the epic tale of outlaw Arthur Morgan and the infamous Van der Linde gang, on the run across America at the dawn of the modern age. Also includes access to the shared living world of Red Dead Online.",93
0,1677740,"['Multi-player', 'PvP', 'Online PvP', 'Cross-Platform Multiplayer', 'In-App Purchases', 'Partial Controller Support']",Action,https://cdn.akamai.steamstatic.com/steam/apps/1677740/header.jpg?t=1650527635,"Race through obstacle courses against up to 32 players online. Run, jump and dash to the finish line until the best player takes the crown!",
0,892970,"['Single-player', 'Multi-player', 'Co-op', 'Online Co-op', 'Full controller support', 'Steam Cloud', 'Remote Play on Tablet']",Action,https://cdn.akamai.steamstatic.com/steam/apps/892970/header.jpg?t=1647939640,"A brutal exploration and survival game for 1-10 players, set in a procedurally-generated purgatory inspired by viking culture. Battle, build, and conquer your way to a saga worthy of Odin’s patronage!",
0,1418630,"['Multi-player', 'PvP', 'Online PvP', 'Co-op', 'Online Co-op', 'Steam Achievements', 'Steam Cloud', 'Valve Anti-Cheat enabled']",Action,https://cdn.akamai.steamstatic.com/steam/apps/1418630/header.jpg?t=1656500054,"A game of survival and betrayal. Eight Explorers path their ship through the unforgiving Arctic. Among the crew, two traitors call on dark powers to undermine them.",
0,236850,"['Single-player', 'Multi-player', 'Cross-Platform Multiplayer', 'Steam Achievements', 'Steam Trading Cards', 'Steam Workshop', 'Steam Cloud']",Simulation,https://cdn.akamai.steamstatic.com/steam/apps/236850/header.jpg?t=1653383580,"Europa Universalis IV gives you control of a nation through four dramatic centuries. Rule your land and dominate the world with unparalleled freedom, depth and historical accuracy. Write a new history of the world and build an empire for the ages.",87
0,582010,"['Single-player', 'Multi-player', 'Co-op', 'Steam Achievements', 'Steam Trading Cards', 'Partial Controller Support', 'Steam Cloud', 'Stats', 'Steam Leaderboards', 'Remote Play on Tablet']",Action,https://cdn.akamai.steamstatic.com/steam/apps/582010/header.jpg?t=1644281885,"Welcome to a new world! In Monster Hunter: World, the latest installment in the series, you can enjoy the ultimate hunting experience, using everything at your disposal to hunt monsters in a new world teeming with surprises and excitement.",88
0,377160,"['Solo', 'Succès Steam', 'Compat. contrôleurs complète', 'Steam Cloud', 'Remote Play sur téléphone', 'Remote Play sur tablette', 'Remote Play sur télévision']",RPG,https://cdn.akamai.steamstatic.com/steam/apps/377160/header.jpg?t=1650909928,"Bethesda Game Studios, studio de développement maintes fois récompensé à l'origine de Fallout 3 et de The Elder Scrolls V: Skyrim, vous invite à découvrir Fallout 4, leur titre le plus ambitieux à ce jour incarnant la nouvelle génération du jeu en monde ouvert.",84
0,306130,"['Multi-player', 'MMO', 'PvP', 'Online PvP', 'Co-op', 'Online Co-op', 'Steam Trading Cards', 'Captions available', 'In-App Purchases', 'Partial Controller Support']",Action,https://cdn.akamai.steamstatic.com/steam/apps/306130/header.jpg?t=1655833559,"Join over 20 million players in the award-winning online multiplayer RPG and experience limitless adventure in a persistent Elder Scrolls world. Battle, craft, steal, or explore, and combine different types of equipment and abilities to create your own style of play. No game subscription required.",80
0,8930,"['Single-player', 'Multi-player', 'Steam Achievements', 'Steam Trading Cards', 'Steam Cloud', 'Remote Play on Tablet']",Strategy,https://cdn.akamai.steamstatic.com/steam/apps/8930/header.jpg?t=1579731804,"Create, discover, and download new player-created maps, scenarios, interfaces, and more!",90
