,steam_appid,categories,genres,header_image,short_description,meta
0,1426210,"['Multi-player', 'Co-op', 'Online Co-op', 'Shared/Split Screen Co-op', 'Shared/Split Screen', 'Steam Achievements', 'Full controller support', 'Steam Trading Cards', 'Remote Play Together']",Action,https://cdn.akamai.steamstatic.com/steam/apps/1426210/header.jpg?t=1654700680,Embark on the craziest journey of your life in It Takes Two. Invite a friend to join for free with Friend’s Pass and work together across a huge variety of gleefully disruptive gameplay challenges. Winner of GAME OF THE YEAR at the Game Awards 2021.,89
0,444090,"['Multi-player', 'PvP', 'Online PvP', 'Steam Achievements', 'Full controller support', 'Steam Trading Cards', 'In-App Purchases', 'Remote Play on Phone', 'Remote Play on Tablet']",Action,https://cdn.akamai.steamstatic.com/steam/apps/444090/header.jpg?t=1656684438,"Join 50+ million players in Paladins, the free-to-play fantasy team-based shooter sensation. Wield guns and magic as a legendary Champion of the Realm, customizing your core set of abilities to play exactly how you want to play.",83
0,1293830,"['Single-player', 'Multi-player', 'PvP', 'Online PvP', 'Co-op', 'Online Co-op', 'Cross-Platform Multiplayer', 'Steam Achievements', 'Full controller support', 'Steam Trading Cards', 'Steam Cloud']",Racing,https://cdn.akamai.steamstatic.com/steam/apps/1293830/header.jpg?t=1622068013,Dynamic seasons change everything at the world’s greatest automotive festival. Go it alone or team up with others to explore beautiful and historic Britain in a shared open world.,
0,244210,"['Single-player', 'Multi-player', 'PvP', 'Online PvP', 'Steam Achievements', 'Partial Controller Support', 'Steam Leaderboards', 'Includes level editor']",Indie,https://cdn.akamai.steamstatic.com/steam/apps/244210/header.jpg?t=1651677274,"Assetto Corsa v1.16 introduces the new &quot;Laguna Seca&quot; laser-scanned track, 7 new cars among which the eagerly awaited Alfa Romeo Giulia Quadrifoglio! Check the changelog for further info!",85
0,761890,"['Multi-player', 'MMO', 'PvP', 'Online PvP', 'Cross-Platform Multiplayer', 'Steam Achievements', 'In-App Purchases']",Free to Play,https://cdn.akamai.steamstatic.com/steam/apps/761890/header.jpg?t=1657137073,"Albion Online is a fantasy sandbox MMORPG featuring a player-driven economy, classless combat system, and intense PvP battles. Explore a vast open world full of danger and opportunity. Grow your wealth, forge alliances, and leave your mark on the world of Albion.",72
0,376210,"['Multi-player', 'MMO', 'PvP', 'Online PvP', 'Partial Controller Support', 'Valve Anti-Cheat enabled']",Action,https://cdn.akamai.steamstatic.com/steam/apps/376210/header.jpg?t=1653237914,Experience fierce open world survival gameplay as you attempt to stay alive on an unforgiving island inhabited by dinosaurs! Hunt. Grow. Survive.,
0,268910,"['Single-player', 'Multi-player', 'Co-op', 'Shared/Split Screen Co-op', 'Shared/Split Screen', 'Steam Achievements', 'Full controller support', 'Steam Trading Cards', 'Steam Cloud', 'Remote Play on Phone', 'Remote Play on Tablet', 'Remote Play on TV', 'Remote Play Together']",Action,https://cdn.akamai.steamstatic.com/steam/apps/268910/header.jpg?t=1657135475,"Cuphead is a classic run and gun action game heavily focused on boss battles. Inspired by cartoons of the 1930s, the visuals and audio are painstakingly created with the same techniques of the era, i.e. traditional hand drawn cel animation, watercolor backgrounds, and original jazz recordings.",88
0,367520,"['Single-player', 'Steam Achievements', 'Full controller support', 'Steam Trading Cards', 'Steam Cloud', 'Remote Play on Phone', 'Remote Play on Tablet', 'Remote Play on TV']",Action,https://cdn.akamai.steamstatic.com/steam/apps/367520/header.jpg?t=1625363925,"Forge your own path in Hollow Knight! An epic action adventure through a vast ruined kingdom of insects and heroes. Explore twisting caverns, battle tainted creatures and befriend bizarre bugs, all in a classic, hand-drawn 2D style.",87
0,1062520,"['Single-player', 'Multi-player', 'Co-op', 'Online Co-op', 'Partial Controller Support']",Indie,https://cdn.akamai.steamstatic.com/steam/apps/1062520/header.jpg?t=1657785140,"G’Day! Get ready to start a new fair Dinkum life and build your new home out in the bush. Explore tropical eucalyptus forests, scorching deserts and cool billabongs on an Island inspired by the wild Australian outback. Take care of giant wombats, play with friends and get ready for a ripper time!",
0,1286830,"['Multi-player', 'MMO', 'PvP', 'Co-op', 'Steam Achievements', 'Steam Trading Cards', 'In-App Purchases']",Free to Play,https://cdn.akamai.steamstatic.com/steam/apps/1286830/header.jpg?t=1645090351,"STAR WARS™: The Old Republic™ is a free-to-play MMORPG that puts you at the center of your own story-driven saga. Play as a Jedi, Sith, Bounty Hunter, or one of many other iconic STAR WARS roles in the galaxy far, far away over three thousand years before the classic films.",85
0,779340,"['Single-player', 'Multi-player', 'PvP', 'Online PvP', 'LAN PvP', 'Co-op', 'Online Co-op', 'LAN Co-op', 'Steam Achievements', 'Steam Trading Cards', 'Steam Cloud']",Action,https://cdn.akamai.steamstatic.com/steam/apps/779340/header.jpg?t=1653315123,"Total War: THREE KINGDOMS is the first in the award-winning series to recreate epic conflict across ancient China. Combining a gripping turn-based campaign of empire-building &amp; conquest with stunning real-time battles, THREE KINGDOMS redefines the series in an age of heroes &amp; legends.",85
0,787860,"['Single-player', 'Multi-player', 'Co-op', 'Online Co-op', 'Steam Achievements', 'Full controller support', 'Steam Trading Cards', 'Steam Cloud', 'Remote Play on Tablet', 'Remote Play on TV']",Simulation,https://cdn.akamai.steamstatic.com/steam/apps/787860/header.jpg?t=1656710432,"The best-selling franchise takes a giant leap forward with a complete overhaul of the graphics engine, offering the most striking and immersive visuals and effects, along with the deepest and most complete farming experience ever.",73
0,231430,"['Single-player', 'Multi-player', 'PvP', 'Online PvP', 'Co-op', 'Online Co-op', 'Steam Achievements', 'Steam Trading Cards', 'Steam Workshop', 'Steam Cloud', 'Stats']",Strategy,https://cdn.akamai.steamstatic.com/steam/apps/231430/header.jpg?t=1655744009,"Experience the ultimate WWII RTS platform with COH2 and its standalone expansions. This package includes the base game, which you can then upgrade by purchasing The Western Front Armies, Ardennes Assault and/or The British Forces. More info in the &quot;About This Game&quot; section below.",80
0,244850,"['Single-player', 'Multi-player', 'PvP', 'Online PvP', 'Co-op', 'Steam Achievements', 'Steam Workshop', 'Partial Controller Support', 'Steam Cloud', 'Includes level editor']",Action,https://cdn.akamai.steamstatic.com/steam/apps/244850/header.jpg?t=1651568388,"Space Engineers is a sandbox game about engineering, construction, exploration and survival in space and on planets. Players build space ships, space stations, planetary outposts of various sizes and uses, pilot ships and travel through space to explore planets and gather resources to survive.",
0,945360,"['Multi-player', 'PvP', 'Online PvP', 'LAN PvP', 'Co-op', 'Online Co-op', 'LAN Co-op', 'Cross-Platform Multiplayer', 'Full controller support', 'Remote Play on Phone', 'Remote Play on Tablet']",Casual,https://cdn.akamai.steamstatic.com/steam/apps/945360/header.jpg?t=1646296970,An online and local party game of teamwork and betrayal for 4-15 players...in space!,85
0,311210,"['Single-player', 'Multi-player', 'Co-op', 'Shared/Split Screen', 'Steam Achievements', 'Full controller support', 'Steam Trading Cards', 'Steam Workshop', 'Valve Anti-Cheat enabled', 'Steam Leaderboards', 'Remote Play on Phone', 'Remote Play on Tablet', 'Remote Play on TV', 'Remote Play Together']",Action,https://cdn.akamai.steamstatic.com/steam/apps/311210/header.jpg?t=1646763462,Call of Duty®: Black Ops III Zombies Chronicles Edition includes the full base game plus the Zombies Chronicles content expansion.,73
0,1466860,"['Single-player', 'Multi-player', 'PvP', 'Online PvP', 'Co-op', 'Online Co-op', 'Cross-Platform Multiplayer', 'Steam Achievements']",Strategy,https://cdn.akamai.steamstatic.com/steam/apps/1466860/header_alt_assets_1.jpg?t=1657908738,"One of the most beloved real-time strategy games returns to glory with Age of Empires IV, putting you at the center of epic historical battles that shaped the world.",81
0,814380,"['Single-player', 'Steam Achievements', 'Full controller support', 'Steam Trading Cards', 'Steam Cloud', 'Remote Play on Tablet', 'Remote Play on TV']",Action,https://cdn.akamai.steamstatic.com/steam/apps/814380/header.jpg?t=1603904569,"Game of the Year - The Game Awards 2019 Best Action Game of 2019 - IGN Carve your own clever path to vengeance in the award winning adventure from developer FromSoftware, creators of Bloodborne and the Dark Souls series. Take Revenge. Restore Your Honor. Kill Ingeniously.",88
0,1250410,"['Single-player', 'Multi-player', 'Steam Achievements', 'Full controller support', 'In-App Purchases']",Simulation,https://cdn.akamai.steamstatic.com/steam/apps/1250410/header.jpg?t=1655148097,"Thank you to our fans – new and old! Microsoft Flight Simulator Game of the Year (GOTY) Edition offers 5 all-new aircrafts, 8 new handcrafted airports, 6 new Discovery Flights, new tutorials, and updates to the weather system. GOTY Edition is free for existing users. The sky is calling!",91
0,534380,"['Single-player', 'Multi-player', 'Co-op', 'Online Co-op', 'Steam Achievements', 'Full controller support', 'Steam Cloud', 'Remote Play on TV']",Action,https://cdn.akamai.steamstatic.com/steam/apps/534380/header.jpg?t=1657817399,"The virus won and civilization has fallen back to the Dark Ages. The City, one of the last human settlements, is on the brink of collapse. Use your agility and combat skills to survive, and reshape the world. Your choices matter.",
0,613100,"['Single-player', 'Steam Achievements', 'Full controller support', 'Steam Trading Cards', 'Steam Workshop', 'Steam Cloud', 'Remote Play on Tablet']",Indie,https://cdn.akamai.steamstatic.com/steam/apps/613100/header.jpg?t=1658175656,"House Flipper is a unique chance to become a one-man renovation crew. Buy, repair and remodel devastated houses. Give them a second life and sell them at a profit!",68
0,270880,"['Single-player', 'Multi-player', 'Co-op', 'Online Co-op', 'Steam Achievements', 'Steam Trading Cards', 'Steam Workshop', 'Partial Controller Support', 'Steam Cloud', 'Includes level editor', 'Remote Play Together']",Indie,https://cdn.akamai.steamstatic.com/steam/apps/270880/header.jpg?t=1657337326,"Experience legendary American trucks and deliver various cargoes across sunny California, sandy Nevada, and the Grand Canyon State of Arizona. American Truck Simulator takes you on a journey through the breathtaking landscapes and widely recognized landmarks around the States.",76
0,1049590,"['Multi-player', 'PvP', 'Online PvP', 'Steam Trading Cards', 'In-App Purchases']",Free to Play,https://cdn.akamai.steamstatic.com/steam/apps/1049590/header.jpg?t=1657791448,"Eternal Return is the unique multiplayer online survival arena that combines strategy, mechanics, and aesthetic characters. Choose one of the ever-growing cast of test subjects, take on Lumia Island as one of 18 test subjects - either solo or with a team, and prove your strength, ability, and wit.",
0,240,"['Multi-player', 'Cross-Platform Multiplayer', 'Steam Achievements', 'Steam Cloud', 'Valve Anti-Cheat enabled', 'Stats', 'Includes Source SDK']",Action,https://cdn.akamai.steamstatic.com/steam/apps/240/header.jpg?t=1602536047,Counter-Strike: Source blends Counter-Strike's award-winning teamplay action with the advanced technology of Source™ technology.,88
0,686810,"['Multi-player', 'PvP', 'Online PvP', 'Steam Achievements', 'Partial Controller Support']",Action,https://cdn.akamai.steamstatic.com/steam/apps/686810/header.jpg?t=1658225019,"Join the ever expanding experience of Hell Let Loose - a hardcore World War Two first person shooter with epic battles of 100 players with infantry, tanks, artillery, a dynamically shifting front line and a unique resource based RTS-inspired meta-game.",79
0,1238840,"['Single-player', 'Multi-player', 'PvP', 'Online PvP', 'Steam Achievements', 'Full controller support', 'Steam Trading Cards']",Action,https://cdn.akamai.steamstatic.com/steam/apps/1238840/header.jpg?t=1633006806,"Battlefield™ 1 takes you back to The Great War, WW1, where new technology and worldwide conflict changed the face of warfare forever.",
0,214950,"['Single-player', 'Multi-player', 'PvP', 'Online PvP', 'LAN PvP', 'Co-op', 'Online Co-op', 'LAN Co-op', 'Steam Trading Cards', 'Steam Cloud']",Strategy,https://cdn.akamai.steamstatic.com/steam/apps/214950/header.jpg?t=1610468283,"Emperor Edition is the definitive edition of ROME II, featuring an improved politics system, overhauled building chains, rebalanced battles and improved visuals in both campaign and battleEmperor Edition contains all free feature updates since its release in 2013, which includes bug fixes, balancing, Twitch.",76
0,286160,"['Single-player', 'Multi-player', 'PvP', 'Online PvP', 'Shared/Split Screen PvP', 'Co-op', 'Online Co-op', 'Shared/Split Screen Co-op', 'Shared/Split Screen', 'Cross-Platform Multiplayer', 'Steam Achievements', 'Full controller support', 'Steam Trading Cards', 'Steam Workshop', 'Steam Cloud', 'Includes level editor', 'Remote Play Together']",Casual,https://cdn.akamai.steamstatic.com/steam/apps/286160/header.jpg?t=1620412025,"Tabletop Simulator is the only simulator where you can let your aggression out by flipping the table! There are no rules to follow: just you, a physics sandbox, and your friends. Make your own online board games or play the thousands of community created mods. Unlimited gaming possibilities!",
0,1145360,"['Single-player', 'Full controller support', 'Steam Trading Cards', 'Captions available', 'Steam Cloud', 'Remote Play on Phone', 'Remote Play on Tablet', 'Remote Play on TV']",Action,https://cdn.akamai.steamstatic.com/steam/apps/1145360/header.jpg?t=1624463563,"Defy the god of the dead as you hack and slash out of the Underworld in this rogue-like dungeon crawler from the creators of Bastion, Transistor, and Pyre.",93
0,714010,"['Single-player', 'Steam Achievements', 'Full controller support', 'Steam Workshop', 'Stats', 'Steam Leaderboards']",Action,https://cdn.akamai.steamstatic.com/steam/apps/714010/header.jpg?t=1657493457,"Aim Lab is the aim trainer of choice for over 20 Million players, from beginners to esports pros. Our unique aim analysis optimizes your gameplay, targets your weaknesses &amp; builds key skills for any FPS/TPS game, all for free! Time to warm up with our unlimited scenarios &amp; rank up in-game!",
0,812140,"['Single-player', 'Steam Achievements', 'Steam Trading Cards', 'Captions available', 'In-App Purchases', 'Partial Controller Support', 'Remote Play on Phone', 'Remote Play on Tablet']",Action,https://cdn.akamai.steamstatic.com/steam/apps/812140/header.jpg?t=1646425720,"Choose your fate in Assassin's Creed® Odyssey. From outcast to living legend, embark on an odyssey to uncover the secrets of your past and change the fate of Ancient Greece.",
0,766570,"['Single-player', 'Multi-player', 'MMO', 'PvP', 'Online PvP', 'Steam Achievements', 'In-App Purchases', 'Stats']",Adventure,https://cdn.akamai.steamstatic.com/steam/apps/766570/header.jpg?t=1643196045,"Russian Fishing 4 is a fishing simulator with RPG elements. There is no story line and the whole process is based on the concept of an open, free to roam and free to play game.",
0,397540,"['Single-player', 'Multi-player', 'Co-op', 'Online Co-op', 'LAN Co-op', 'Cross-Platform Multiplayer', 'Steam Achievements', 'Full controller support', 'Steam Trading Cards', 'Steam Cloud', 'Remote Play on Phone', 'Remote Play on Tablet', 'Remote Play on TV']",Action,https://cdn.akamai.steamstatic.com/steam/apps/397540/header.jpg?t=1657214217,"The original shooter-looter returns, packing bazillions of guns and a mayhem-fueled adventure! Blast through new worlds and enemies as one of four new Vault Hunters.",81
0,22380,"['Single-player', 'Steam Achievements', 'Partial Controller Support', 'Steam Leaderboards', 'Remote Play on Phone', 'Remote Play on Tablet']",Action,https://cdn.akamai.steamstatic.com/steam/apps/22380/header.jpg?t=1586905021,Welcome to Vegas. New Vegas. Enjoy your stay!,84
0,1286680,"['Single-player', 'Multi-player', 'Co-op', 'Online Co-op', 'LAN Co-op', 'Steam Achievements', 'Full controller support']",Action,https://cdn.akamai.steamstatic.com/steam/apps/1286680/header.jpg?t=1657214620,"Embark on an epic adventure full of whimsy, wonder, and high-powered weaponry! Roll your own multiclass hero then shoot, loot, slash, and cast on a quest to stop the Dragon Lord.",
0,1258080,"['Single-player', 'Multi-player', 'MMO', 'Co-op', 'Online Co-op', 'Cross-Platform Multiplayer', 'Steam Achievements', 'Steam Trading Cards', 'In-App Purchases']",Adventure,https://cdn.akamai.steamstatic.com/steam/apps/1258080/header.jpg?t=1641420416,"Shop Titans is the ultimate RPG shopkeeper simulation. Craft powerful equipment, stock your shop and sell to aspiring heroes… at a markup! Hire heroes and explore dungeons to gather valuable materials to craft with. There’s never a dull moment in the world of Shop Titans!",
0,518790,"['Single-player', 'Multi-player', 'Co-op', 'Online Co-op', 'Steam Achievements', 'Full controller support', 'In-App Purchases', 'Steam Cloud']",Adventure,https://cdn.akamai.steamstatic.com/steam/apps/518790/header.jpg?t=1656406952,"Experience an atmospheric hunting game like no other in this realistic and visually breathtaking open world. Immerse yourself in the atmospheric single player campaign, or share the ultimate hunting experience with friends.",
0,48700,"['Single-player', 'Multi-player', 'Steam Achievements', 'Steam Trading Cards', 'Steam Workshop']",Action,https://cdn.akamai.steamstatic.com/steam/apps/48700/header.jpg?t=1589227310,"In a land torn asunder by incessant warfare, it is time to assemble your own band of hardened warriors and enter the fray. Lead your men into battle, expand your realm, and claim the ultimate prize: the throne of Calradia!",78
0,1184370,"['Single-player', 'Steam Achievements', 'Steam Trading Cards', 'Steam Cloud']",Adventure,https://cdn.akamai.steamstatic.com/steam/apps/1184370/header.jpg?t=1658242001,"Embark on a journey to a realm overrun by demons in a new epic RPG from the creators of the critically acclaimed Pathfinder: Kingmaker. Explore the nature of good and evil, learn the true cost of power, and rise as a Mythic Hero capable of deeds beyond mortal expectations.",83
0,219990,"['Single-player', 'Multi-player', 'Co-op', 'Online Co-op', 'LAN Co-op', 'Steam Achievements', 'Full controller support', 'Steam Trading Cards', 'Steam Cloud', 'Remote Play on Tablet', 'Remote Play on TV']",Action,https://cdn.akamai.steamstatic.com/steam/apps/219990/header.jpg?t=1639672339,"Enter an apocalyptic fantasy world where humanity is on the brink of extinction, iron is valued above gold and trust is hard earned. This ARPG features complex character development, hundreds of unique items, crafting and quests with choice &amp; consequence.",83
0,703080,"['Jednoosobowa', 'Osiągnięcia Steam', 'Karty kolekcjonerskie Steam', 'Warsztat Steam', 'Steam Cloud']",Rekreacyjne,https://cdn.akamai.steamstatic.com/steam/apps/703080/header_alt_assets_1.jpg?t=1655824420,"Build a world for wildlife in Planet Zoo. From the developers of Planet Coaster and Zoo Tycoon comes the ultimate zoo sim. Construct detailed habitats, manage your zoo, and meet authentic living animals who think, feel and explore the world you create around them.",81
0,627690,"['Single-player', 'Steam Achievements', 'Steam Trading Cards', 'In-App Purchases', 'Remote Play on Tablet']",Action,https://cdn.akamai.steamstatic.com/steam/apps/627690/header_alt_assets_14.jpg?t=1657835932,Idle Champions of the Forgotten Realms is a Dungeons &amp; Dragons strategy management game uniting characters from throughout the D&amp;D multiverse into a grand adventure.,
0,389730,"['Single-player', 'Multi-player', 'PvP', 'Online PvP', 'Shared/Split Screen PvP', 'Shared/Split Screen', 'Steam Achievements', 'Full controller support', 'Steam Trading Cards', 'Steam Cloud', 'Steam Leaderboards', 'Remote Play on TV', 'Remote Play Together']",Action,https://cdn.akamai.steamstatic.com/steam/apps/389730/header.jpg?t=1638999755,"Discover the epic conclusion of the long-time clan warfare between members of the Mishima family. Powered by Unreal Engine 4, the legendary fighting game franchise fights back with stunning story-driven cinematic battles and intense duels that can be enjoyed with friends and rivals.",82
0,365670,,Animation & Modeling,https://cdn.akamai.steamstatic.com/steam/apps/365670/header.jpg?t=1646841118,"Blender is the free and open source 3D creation suite. Free to use for everyone, for any purpose.",
0,1593500,"['Single-player', 'Steam Achievements', 'Full controller support', 'Steam Cloud', 'Remote Play on TV']",Action,https://cdn.akamai.steamstatic.com/steam/apps/1593500/header.jpg?t=1650554420,"His vengeance against the Gods of Olympus years behind him, Kratos now lives as a man in the realm of Norse Gods and monsters. It is in this harsh, unforgiving world that he must fight to survive… and teach his son to do the same.",93
0,1144200,"['Single-player', 'Multi-player', 'Co-op', 'Online Co-op', 'Steam Cloud']",Action,https://cdn.akamai.steamstatic.com/steam/apps/1144200/header.jpg?t=1656646890,"Ready or Not is an intense, tactical, first-person shooter that depicts a modern-day world in which SWAT police units are called to defuse hostile and confronting situations.",
0,239140,"['Single-player', 'Multi-player', 'PvP', 'Online PvP', 'Co-op', 'Online Co-op', 'Steam Achievements', 'Full controller support', 'Steam Trading Cards', 'Steam Workshop', 'Steam Cloud', 'Valve Anti-Cheat enabled', 'Includes level editor', 'Remote Play on Tablet', 'Remote Play on TV']",Action,https://cdn.akamai.steamstatic.com/steam/apps/239140/header.jpg?t=1657116172,"First-person action survival game set in a post-apocalyptic open world overrun by flesh-hungry zombies. Roam a city devastated by a mysterious virus epidemic. Scavenge for supplies, craft weapons, and face hordes of the infected.",87
0,1343400,"['Multi-player', 'MMO', 'Cross-Platform Multiplayer', 'Steam Achievements', 'In-App Purchases']",Free to Play,https://cdn.akamai.steamstatic.com/steam/apps/1343400/header.jpg?t=1653412331,"RuneScape is a high fantasy open world MMORPG. Explore an ever changing and evolving living world where new challenges, skills, and quests await. Featuring unprecedented player freedom, you choose how to play, adventure, and grow.",
0,1517290,"['Multi-player', 'PvP', 'Online PvP', 'Co-op', 'Online Co-op', 'Steam Achievements', 'Full controller support', 'Steam Trading Cards', 'In-App Purchases']",Action,https://cdn.akamai.steamstatic.com/steam/apps/1517290/header.jpg?t=1655391133,Unleash the unexpected with Battlefield™ 2042 – Season 1: Zero Hour. Battlefield™ 2042 is a first-person shooter that marks the return to the iconic all-out warfare of the franchise.,
0,680420,"['Single-player', 'Multi-player', 'Co-op', 'Online Co-op', 'Cross-Platform Multiplayer', 'Steam Achievements', 'Full controller support', 'Steam Trading Cards']",Action,https://cdn.akamai.steamstatic.com/steam/apps/680420/header_alt_assets_2.jpg?t=1657806851,"Outriders’ brutal and bloody combat combines frenetic gunplay, violent powers and deep RPG systems to create a true genre hybrid.",
0,1100600,"['Single-player', 'Multi-player', 'Steam Achievements', 'Steam Workshop', 'Steam Cloud', 'Steam Leaderboards']",Simulation,https://cdn.akamai.steamstatic.com/steam/apps/1100600/header.jpg?t=1608137526,"Run your football club, your way. Every decision counts in Football Manager 2020 with new features and polished game mechanics rewarding planning and progression like never before, empowering managers to develop and refine both your club’s and your own unique identity.",84
0,1086940,"['Single-player', 'Multi-player', 'Co-op', 'Online Co-op', 'LAN Co-op', 'Steam Cloud']",Adventure,https://cdn.akamai.steamstatic.com/steam/apps/1086940/header.jpg?t=1657252325,"Gather your party, and return to the Forgotten Realms in a tale of fellowship and betrayal, sacrifice and survival, and the lure of absolute power.",
0,268500,"['Single-player', 'Steam Achievements', 'Steam Trading Cards', 'Steam Workshop', 'Steam Cloud', 'Remote Play on Tablet']",Strategy,https://cdn.akamai.steamstatic.com/steam/apps/268500/header.jpg?t=1646157374,"XCOM 2 is the sequel to XCOM: Enemy Unknown, the 2012 award-winning strategy game of the year. Earth has changed and is now under alien rule. Facing impossible odds you must rebuild XCOM, and ignite a global resistance to reclaim our world and save humanity.",88
0,1366540,"['Single-player', 'Remote Play on Tablet']",Indie,https://cdn.akamai.steamstatic.com/steam/apps/1366540/header.jpg?t=1656474588,"Build the most efficient intergalactic factory in space simulation strategy game Dyson Sphere Program! Harness the power of stars, collect resources, plan and design production lines and develop your interstellar factory from a small space workshop to a galaxy-wide industrial empire.",
