,steam_appid,categories,genres,header_image,short_description,meta
0,287700,"['Single-player', 'Multi-player', 'Steam Achievements', 'Full controller support', 'Steam Trading Cards', 'Captions available', 'Steam Cloud', 'Steam Leaderboards', 'Remote Play on Phone', 'Remote Play on Tablet', 'Remote Play on TV']",Action,https://cdn.akamai.steamstatic.com/steam/apps/287700/header.jpg?t=1653977206,"Ushering in a new era for the METAL GEAR franchise with cutting-edge technology powered by the Fox Engine, METAL GEAR SOLID V: The Phantom Pain, will provide players a first-rate gaming experience as they are offered tactical freedom to carry out open-world missions.",91
0,466560,"['Single-player', 'Multi-player', 'PvP', 'Online PvP', 'Co-op', 'Online Co-op', 'Steam Achievements', 'Steam Trading Cards', 'Steam Cloud']",Indie,https://cdn.akamai.steamstatic.com/steam/apps/466560/header.jpg?t=1650986464,Northgard is a strategy game based on Norse mythology in which you control a clan of Vikings vying for the control of a mysterious newfound continent.,81
0,602960,"['Single-player', 'Multi-player', 'PvP', 'Online PvP', 'Co-op', 'Online Co-op', 'Steam Achievements', 'Steam Trading Cards', 'Steam Workshop', 'Steam Cloud', 'Includes level editor']",Action,https://cdn.akamai.steamstatic.com/steam/apps/602960/header.jpg?t=1651768316,"Barotrauma is a 2D co-op submarine simulator – in space, with survival horror elements. Steer your submarine, give orders, fight monsters, fix leaks, operate machinery, man the guns and craft items, and stay alert: danger in Barotrauma doesn’t announce itself!",
0,573090,"['Single-player', 'Multi-player', 'PvP', 'Online PvP', 'Co-op', 'Online Co-op', 'Steam Workshop', 'Partial Controller Support']",Simulation,https://cdn.akamai.steamstatic.com/steam/apps/573090/header_alt_assets_2.jpg?t=1654186079,"Join a world where you design, create and pilot your own air sea rescue service. Release your inner hero as you battle fierce storms out at sea to rescue those in need.",
0,635260,"['Single-player', 'Multi-player', 'PvP', 'Online PvP', 'Co-op', 'Online Co-op', 'Steam Achievements', 'Full controller support', 'Steam Trading Cards', 'Steam Workshop', 'Remote Play on Phone', 'Remote Play on Tablet']",Massively Multiplayer,https://cdn.akamai.steamstatic.com/steam/apps/635260/header.jpg?t=1656514798,"CarX Drift Racing Online is your chance to immerse yourself in the real world of drifting. Get together with friends, tune your car and burn some tires!",
0,1259420,"['Single-player', 'Steam Achievements', 'Full controller support', 'Steam Cloud']",Action,https://cdn.akamai.steamstatic.com/steam/apps/1259420/header.jpg?t=1635476187,"Ride and fight into a deadly, post pandemic America. Play as Deacon St. John, a drifter and bounty hunter who rides the broken road, fighting to survive while searching for a reason to live in this open-world action-adventure game.",
0,1009850,,Utilities,https://cdn.akamai.steamstatic.com/steam/apps/1009850/header.jpg?t=1591904857,"A Dashboard Application for VR, that allows you to access many settings, and provide a litany of utility features, such as timers, audio settings, push-to-talk and more.",
0,977950,"['Single-player', 'Steam Achievements', 'Steam Workshop', 'Partial Controller Support', 'Steam Cloud', 'Includes level editor', 'Remote Play on Phone', 'Remote Play on Tablet']",Indie,https://cdn.akamai.steamstatic.com/steam/apps/977950/header.jpg?t=1656700566,A Dance of Fire and Ice is a strict rhythm game. Keep your focus as you guide two orbiting planets along a winding path without breaking their perfect equilibrium.,
0,1041320,"['Multi-player', 'MMO', 'PvP', 'Online PvP', 'Cross-Platform Multiplayer', 'In-App Purchases', 'Remote Play on Phone', 'Remote Play on Tablet']",Massively Multiplayer,https://cdn.akamai.steamstatic.com/steam/apps/1041320/header.jpg?t=1658203016,Clash with global players in this epic real-time strategy game!,
0,552520,"['Single-player', 'Multi-player', 'Co-op', 'Online Co-op', 'Steam Trading Cards', 'Captions available', 'In-App Purchases', 'Partial Controller Support', 'Includes level editor']",Action,https://cdn.akamai.steamstatic.com/steam/apps/552520/header.jpg?t=1628209646,"Welcome to Hope County, Montana, home to a fanatical doomsday cult known as Eden’s Gate. Stand up to cult leader Joseph Seed &amp; his siblings, the Heralds, to spark the fires of resistance &amp; liberate the besieged community.",
0,920210,"['Single-player', 'Multi-player', 'Co-op', 'Shared/Split Screen Co-op', 'Shared/Split Screen', 'Steam Achievements', 'Full controller support', 'Remote Play on Phone', 'Remote Play on Tablet', 'Remote Play Together']",Action,https://cdn.akamai.steamstatic.com/steam/apps/920210/header.jpg?t=1652462340,"Play through all nine Skywalker saga films in a game unlike any other. With over 300 playable characters, over 100 vehicles, and 23 planets to explore, a galaxy far, far away has never been more fun! *Includes classic Obi-Wan Kenobi playable character",
0,356190,"['Single-player', 'Steam Achievements', 'Full controller support', 'Steam Trading Cards', 'In-App Purchases', 'Steam Cloud']",Action,https://cdn.akamai.steamstatic.com/steam/apps/356190/header.jpg?t=1575317164,"Experience an epic open-world brought to life by the award-winning Nemesis System. Forge a new Ring of Power, conquer Fortresses in massive battles and dominate Mordor with your personal orc army in Middle-earth™: Shadow of War™.",
0,218230,"['Multi-player', 'MMO', 'PvP', 'Online PvP', 'Steam Trading Cards', 'Steam Cloud']",Action,https://cdn.akamai.steamstatic.com/steam/apps/218230/header.jpg?t=1658161691,"PlanetSide 2 is an all-out planetary war, where thousands of players battle as one across enormous continents. Utilize infantry, ground and air vehicles, and teamwork to destroy your enemies in this revolutionary first-person shooter on a massive scale.",84
0,637090,"['Single-player', 'Multi-player', 'PvP', 'Online PvP', 'Cross-Platform Multiplayer', 'Steam Achievements', 'Steam Trading Cards', 'Steam Cloud', 'Remote Play Together']",Action,https://cdn.akamai.steamstatic.com/steam/apps/637090/header.jpg?t=1615972925,"Take command of your own mercenary outfit of 'Mechs and the MechWarriors that pilot them, struggling to stay afloat as you find yourself drawn into a brutal interstellar civil war.",78
0,363970,"['Single-player', 'Steam Achievements', 'Steam Trading Cards', 'In-App Purchases', 'Steam Cloud', 'Stats']",Adventure,https://cdn.akamai.steamstatic.com/steam/apps/363970/header.jpg?t=1656459436,Ever wondered what one quadrillion damage per second feels like? Wonder no more! Embark on your quest to attain it today!,
0,346900,"['Single-player', 'Steam Achievements', 'Steam Trading Cards', 'Steam Cloud']",Casual,https://cdn.akamai.steamstatic.com/steam/apps/346900/header.jpg?t=1606160039,"Welcome, eager young investor, to AdVenture Capitalist! Arguably the world's greatest Capitalism simulator!",
0,387990,"['Single-player', 'Multi-player', 'Co-op', 'Online Co-op', 'Steam Workshop', 'Steam Cloud', 'Includes level editor']",Action,https://cdn.akamai.steamstatic.com/steam/apps/387990/header.jpg?t=1593703247,"Enter the creative paradise of Scrap Mechanic! Build fantastic machines, go on adventures with your friends and defend against waves of evil Farmbots in this imaginative multiplayer survival sandbox. With Scrap Mechanic’s powerful creation tools you can engineer your own adventures!",
0,312660,"['Single-player', 'Multi-player', 'Co-op', 'Steam Achievements', 'Full controller support', 'Steam Trading Cards', 'Steam Cloud', 'Steam Leaderboards', 'Remote Play on TV']",Action,https://cdn.akamai.steamstatic.com/steam/apps/312660/header.jpg?t=1636393785,"Discover unrivalled sniping freedom in the largest and most advanced World War 2 shooter ever built. Experience tactical third-person combat, gameplay choice and epic longshots across gigantic levels as you liberate wartime Italy from the grip of Fascism.",78
0,1129580,"['Single-player', 'Steam Achievements', 'Full controller support', 'Steam Trading Cards', 'Steam Cloud']",Action,https://cdn.akamai.steamstatic.com/steam/apps/1129580/header.jpg?t=1656927198,"Hunt, survive, build and lead in the harsh Middle Ages: Create your own Medieval Dynasty and ensure its long-lasting prosperity or die trying!",73
0,1879330,"['Single-player', 'Multi-player', 'PvP', 'Shared/Split Screen PvP', 'Co-op', 'Shared/Split Screen Co-op', 'Shared/Split Screen', 'Steam Achievements', 'Full controller support', 'Steam Trading Cards', 'Steam Cloud']",Action,https://cdn.akamai.steamstatic.com/steam/apps/1879330/header.jpg?t=1657674001,"The truly ultimate &quot;WARRIORS OROCHI 3&quot; is now available on Steam! With all the content of &quot;WARRIORS OROCHI 3&quot;, new characters and episodes that deepen the story, new modes, and DLC that has been released for other platforms, enjoy the world of Orochi to your heart's content!",
0,1046930,"['Single-player', 'Multi-player', 'PvP', 'Online PvP', 'Cross-Platform Multiplayer', 'Partial Controller Support', 'Steam Cloud', 'Remote Play on Phone', 'Remote Play on Tablet']",Casual,https://cdn.akamai.steamstatic.com/steam/apps/1046930/header.jpg?t=1649700104,"Hire a crew and destroy your rivals in this new strategy battler set in the world of Dota. Introducing Season One: Explore White Spire and earn rewards on the Battle Pass. Pick from several different game modes, play on your own or with friends, and take advantage of crossplay on PC and mobile.",
0,219740,"['Single-player', 'Full controller support', 'Steam Trading Cards', 'Steam Workshop', 'Steam Cloud', 'Remote Play on Phone', 'Remote Play on Tablet', 'Remote Play on TV']",Adventure,https://cdn.akamai.steamstatic.com/steam/apps/219740/header.jpg?t=1647292111,"Don’t Starve is an uncompromising wilderness survival game full of science and magic. Enter a strange and unexplored world full of strange creatures, dangers, and surprises. Gather resources to craft items and structures that match your survival style.",79
0,1189490,"['Single-player', 'Steam Achievements', 'Steam Workshop', 'Steam Workshop', 'Steam Cloud']",Indie,https://cdn.akamai.steamstatic.com/steam/apps/1189490/header.jpg?t=1656682312,《觅长生》是一款想要还原真实修仙世界的开放世界角色扮演游戏。 在这里，你可以体验到从零开始一步步积攒修为突破境界的逆天修仙之旅，也可以体验到那些充满修仙味的故事和剧情。当然也少不了寻求奇遇、探索秘境，更可以和游戏中的角色互动，与人为善或是杀人夺宝全都由你自己抉择。,
0,1366800,,Action,https://cdn.akamai.steamstatic.com/steam/apps/1366800/header.jpg?t=1621981151,Overlay custom crosshairs on every game you play. Choose from thousands of unique crosshairs created by the Crosshair X community or design your own using the designer.,
0,1149460,"['Single-player', 'Multi-player', 'Co-op', 'Online Co-op']",Action,https://cdn.akamai.steamstatic.com/steam/apps/1149460/header.jpg?t=1657770710,"ICARUS is a session-based PvE survival game for up to eight co-op players or solo. Explore a savage wilderness in the aftermath of terraforming gone wrong. Survive long enough to mine exotic matter, then return to orbit to craft more advanced tech. Meet your deadline or be left behind forever.",
0,1325200,"['Single-player', 'Multi-player', 'Co-op', 'Online Co-op', 'Steam Achievements', 'Steam Trading Cards', 'Partial Controller Support', 'Steam Cloud', 'Stats', 'Steam Leaderboards']",Action,https://cdn.akamai.steamstatic.com/steam/apps/1325200/header.jpg?t=1655226034,Battle hordes of yokai in this masocore Action RPG. Create your protagonist and embark on an adventure through a myriad of locales across Japan during the Sengoku period. Utilize the new Yokai Shift ability to defeat even the most ferocious yokai and be prepared to brave through Dark Realms created by your enemies.,86
0,438040,"['Single-player', 'Multi-player', 'MMO', 'Cross-Platform Multiplayer', 'In-App Purchases']",Adventure,https://cdn.akamai.steamstatic.com/steam/apps/438040/header.jpg?t=1657550506,Shakes and Fidget is a fun fantasy RPG satire and an award-winning role-playing game at the same time! Sounds crazy? Over 50 million players make it one of the most popular online games in the world!Customize your own comic book hero and conquer the top slot of the Hall of Fame!,
0,976310,"['Single-player', 'Multi-player', 'PvP', 'Online PvP', 'Shared/Split Screen PvP', 'Steam Achievements', 'Full controller support', 'Steam Trading Cards', 'In-App Purchases', 'Steam Cloud', 'Remote Play on Phone', 'Remote Play on Tablet', 'Remote Play on TV', 'Remote Play Together']",Action,https://cdn.akamai.steamstatic.com/steam/apps/976310/header.jpg?t=1654216426,Mortal Kombat is back and better than ever in the next evolution of the iconic franchise.,82
0,477160,"['Single-player', 'Multi-player', 'PvP', 'Online PvP', 'Co-op', 'Shared/Split Screen Co-op', 'Shared/Split Screen', 'Steam Achievements', 'Full controller support', 'Steam Trading Cards', 'Steam Workshop', 'Steam Cloud', 'Stats', 'Remote Play on TV', 'Remote Play Together']",Adventure,https://cdn.akamai.steamstatic.com/steam/apps/477160/header.jpg?t=1657213165,"Human: Fall Flat is a hilarious, light-hearted platformer set in floating dreamscapes that can be played solo or with up to 8 players online. Free new levels keep its vibrant community rewarded.",70
0,1225330,"['Single-player', 'Multi-player', 'PvP', 'Online PvP', 'Shared/Split Screen PvP', 'Co-op', 'Online Co-op', 'Shared/Split Screen Co-op', 'Shared/Split Screen', 'Steam Achievements', 'Full controller support', 'In-App Purchases', 'Steam Cloud', 'Remote Play on Tablet', 'Remote Play Together']",Simulation,https://cdn.akamai.steamstatic.com/steam/apps/1225330/header.jpg?t=1614622937,"NBA 2K21 is the latest title in the world-renowned, best-selling NBA 2K series, delivering an industry-leading sports video game experience.",
0,924970,"['Single-player', 'Multi-player', 'PvP', 'Online PvP', 'Co-op', 'Online Co-op', 'Full controller support']",Action,https://cdn.akamai.steamstatic.com/steam/apps/924970/header.jpg?t=1649358821,"Back 4 Blood is a thrilling cooperative first-person shooter from the creators of the critically acclaimed Left 4 Dead franchise. Experience the intense 4 player co-op narrative campaign, competitive multiplayer as human or Ridden, and frenetic gameplay that keeps you in the action.",77
0,1948280,"['Single-player', 'Steam Achievements', 'Steam Trading Cards', 'Partial Controller Support', 'Steam Cloud']",Casual,https://cdn.akamai.steamstatic.com/steam/apps/1948280/header.jpg?t=1657626123,"Stacklands is a village builder where you stack cards to collect food, build structures, and fight creatures. 🃏 For example, dragging a Villager card on top of a Berry Bush card will spawn Berry cards which the villagers can eat to survive. 🃏 Play your cards right and expand your village!",
0,728880,"['Single-player', 'Multi-player', 'PvP', 'Online PvP', 'Shared/Split Screen PvP', 'Co-op', 'Online Co-op', 'Shared/Split Screen Co-op', 'Shared/Split Screen', 'Steam Achievements', 'Full controller support', 'Steam Trading Cards', 'Steam Cloud', 'Remote Play on Phone', 'Remote Play on Tablet', 'Remote Play on TV', 'Remote Play Together']",Action,https://cdn.akamai.steamstatic.com/steam/apps/728880/header.jpg?t=1643298085,Overcooked returns with a brand-new helping of chaotic cooking action! Journey back to the Onion Kingdom and assemble your team of chefs in classic couch co-op or online play for up to four players. Hold onto your aprons… it’s time to save the world again!,81
0,834910,"['Single-player', 'Multi-player', 'MMO', 'PvP', 'Online PvP', 'Co-op', 'Online Co-op', 'Full controller support', 'Steam Workshop', 'Includes level editor']",Action,https://cdn.akamai.steamstatic.com/steam/apps/834910/header.jpg?t=1628208672,"Set sail for the ultimate pirate experience! Embark on a grand adventure alongside thousands of other players in one of the largest game worlds ever built (and even claim a piece of it to call your own). Build your ship, assemble your crew, sail the high seas, and become a pirate legend!",
0,392160,"['Single-player', 'Steam Achievements', 'Full controller support', 'Steam Trading Cards', 'Steam Workshop', 'Steam Cloud']",Action,https://cdn.akamai.steamstatic.com/steam/apps/392160/header.jpg?t=1651672910,"X4: FOUNDATIONS brings our most sophisticated universe SIMULATION ever. Fly every ship, EXPLORE space or manage an empire; TRADE, FIGHT, BUILD and THINK carefully, while you embark on an epic journey. Experience tons of improvements with the massive 5.00 Update!",
0,325610,"['Single-player', 'Multi-player', 'PvP', 'Online PvP', 'LAN PvP', 'Co-op', 'Online Co-op', 'LAN Co-op', 'Steam Achievements', 'Steam Trading Cards', 'Steam Cloud']",Strategy,https://cdn.akamai.steamstatic.com/steam/apps/325610/header.jpg?t=1610534671,"Against a darkening background of famine, disease and war, a new power is rising in the great steppes of the East. With a million horsemen at his back, the ultimate warrior king approaches, and his sights are set on Rome… The next instalment in the multi award-winning PC series that combines turn-based strategy with real-time tactics,...",80
0,471710,"['Multi-player', 'MMO', 'PvP', 'Online PvP', 'Co-op', 'Online Co-op', 'Cross-Platform Multiplayer', 'Full controller support', 'SteamVR Collectibles', 'In-App Purchases', 'Includes level editor']",Adventure,https://cdn.akamai.steamstatic.com/steam/apps/471710/header.jpg?t=1645232812,"Rec Room is the best place to build and play games together. Party up with friends from all around the world to chat, hang out, explore MILLIONS of player-created rooms, or build something new and amazing to share with us all.",
0,1172380,"['Single-player', 'Steam Achievements', 'Full controller support', 'Steam Trading Cards', 'Remote Play on Tablet', 'Remote Play on TV']",Action,https://cdn.akamai.steamstatic.com/steam/apps/1172380/header.jpg?t=1651767465,"A galaxy-spanning adventure awaits in Star Wars Jedi: Fallen Order, a 3rd person action-adventure title from Respawn. An abandoned Padawan must complete his training, develop new powerful Force abilities, and master the art of the lightsaber - all while staying one step ahead of the Empire.",81
0,601150,"['Single-player', 'Multi-player', 'Co-op', 'Online Co-op', 'Steam Achievements', 'Full controller support', 'Steam Trading Cards', 'Steam Cloud', 'Remote Play on TV']",Action,https://cdn.akamai.steamstatic.com/steam/apps/601150/header.jpg?t=1643243335,"The ultimate Devil Hunter is back in style, in the game action fans have been waiting for.",89
0,582160,"['Single-player', 'Steam Achievements', 'Steam Trading Cards', 'Captions available', 'In-App Purchases', 'Partial Controller Support', 'Remote Play on Tablet']",Action,https://cdn.akamai.steamstatic.com/steam/apps/582160/header.jpg?t=1603213581,"ASSASSIN’S CREED® ORIGINS IS A NEW BEGINNING *The Discovery Tour by Assassin’s Creed®: Ancient Egypt is available now as a free update!* Ancient Egypt, a land of majesty and intrigue, is disappearing in a ruthless fight for power.",
0,620,"['Single-player', 'Multi-player', 'Co-op', 'Online Co-op', 'Shared/Split Screen Co-op', 'Shared/Split Screen', 'Steam Achievements', 'Full controller support', 'Steam Trading Cards', 'Captions available', 'Steam Workshop', 'Steam Workshop', 'Steam Cloud', 'Stats', 'Includes level editor', 'Commentary available', 'Remote Play on Phone', 'Remote Play on Tablet', 'Remote Play on TV', 'Remote Play Together']",Action,https://cdn.akamai.steamstatic.com/steam/apps/620/header.jpg?t=1610490805,The &quot;Perpetual Testing Initiative&quot; has been expanded to allow you to design co-op puzzles for you and your friends!,95
0,905370,"['Multi-player', 'MMO', 'PvP', 'Online PvP', 'Co-op', 'Online Co-op', 'In-App Purchases', 'Remote Play on Tablet']",Action,https://cdn.akamai.steamstatic.com/steam/apps/905370/header.jpg?t=1658146943,"Master the art of siege tactics in Conqueror's Blade, a tactical action MMO brought to you by MY.GAMES and Booming Tech. Create your hero, command medieval units, and ride out for epic online battles in a vast new world. Play for free today!",
0,12210,"['Single-player', 'Multi-player', 'Partial Controller Support', 'Remote Play on Phone', 'Remote Play on Tablet']",Action,https://cdn.akamai.steamstatic.com/steam/apps/12210/header.jpg?t=1618853493,"Niko Bellic, Johnny Klebitz and Luis Lopez all have one thing in common - they live in the worst city in America. Liberty City worships money and status, and is heaven for those who have them and a living nightmare for those who don't.",90
0,495420,"['Single-player', 'Multi-player', 'Co-op', 'Online Co-op', 'Cross-Platform Multiplayer', 'Steam Achievements', 'Steam Trading Cards', 'Captions available', 'Partial Controller Support', 'Steam Cloud']",Action,https://cdn.akamai.steamstatic.com/steam/apps/495420/header.jpg?t=1656875548,"The dead have risen and civilization has fallen. Now it's up to you to gather survivors, scavenge for resources and build a community in a post-apocalyptic world – a world where you define what it means to survive in this ultimate zombie survival simulation.",69
0,646910,"['Single-player', 'Multi-player', 'MMO', 'PvP', 'Online PvP', 'Co-op', 'Online Co-op', 'In-App Purchases', 'Partial Controller Support', 'Remote Play on Phone', 'Remote Play on Tablet']",Action,https://cdn.akamai.steamstatic.com/steam/apps/646910/header.jpg?t=1657123216,"Take on the American motorsports scene as you explore and dominate the land, air, and sea across the entire USA. With a wide variety of cars, bikes, boats, and planes, compete in a wide range of driving disciplines.",
0,493340,"['Single-player', 'Steam Achievements', 'Steam Trading Cards', 'Steam Workshop', 'Steam Cloud']",Action,https://cdn.akamai.steamstatic.com/steam/apps/493340/header.jpg?t=1654873696,"Planet Coaster® - the future of coaster park simulation games has arrived! Surprise, delight and thrill incredible crowds as you build your coaster park empire - let your imagination run wild, and share your success with the world.",84
0,962130,"['Single-player', 'Multi-player', 'Co-op', 'Online Co-op', 'Full controller support', 'Steam Trading Cards', 'Steam Cloud', 'Remote Play on Tablet']",Action,https://cdn.akamai.steamstatic.com/steam/apps/962130/header.jpg?t=1655064810,"The world is a vast, beautiful and dangerous place – especially when you have been shrunk to the size of an ant. Can you thrive alongside the hordes of giant insects, fighting to survive the perils of the backyard?",
0,1244460,"['Single-player', 'Steam Achievements', 'Full controller support', 'Steam Cloud', 'Stats']",Simulation,https://cdn.akamai.steamstatic.com/steam/apps/1244460/header.jpg?t=1656322536,Jurassic World Evolution 2 is the much-anticipated sequel to Frontier’s highly successful Jurassic World Evolution. This bold new era in the Jurassic World Evolution game franchise builds upon the ground-breaking and immersive 2018 management simulation.,77
0,1167630,"['Single-player', 'Steam Achievements', 'Full controller support', 'Steam Workshop', 'Steam Cloud', 'Includes level editor', 'Remote Play on Tablet']",Action,https://cdn.akamai.steamstatic.com/steam/apps/1167630/header.jpg?t=1656046119,Prepare the perfect heist in this simulated and fully destructible voxel world. Tear down walls with vehicles or explosives to create shortcuts. Stack objects to reach higher. Use the environment to your advantage in the most creative way you can think of.,80
0,786520,"['Steam Workshop', 'Steam Cloud']",Utilities,https://cdn.akamai.steamstatic.com/steam/apps/786520/header.jpg?t=1645821948,"SAO Utils provides you a customizable Full-Dive 3D app launcher with varieties of themes, desktop widgets and powerful utilities.",
0,47890,['Single-player'],Simulation,https://cdn.akamai.steamstatic.com/steam/apps/47890/header.jpg?t=1615894474,The Sims 3: Create the perfect world with full customization at your fingertips. Refine personalities and help fulfill destinies.,86
0,629760,"['Multi-player', 'PvP', 'Online PvP', 'Co-op', 'Online Co-op', 'Steam Achievements', 'Steam Trading Cards', 'Steam Cloud', 'Valve Anti-Cheat enabled', 'Stats', 'Remote Play on Phone', 'Remote Play on Tablet']",Action,https://cdn.akamai.steamstatic.com/steam/apps/629760/header.jpg?t=1655998210,"MORDHAU is a multiplayer medieval slasher. Create your mercenary and fight in brutal battles where you will experience fast paced combat, castle sieges, cavalry charges, and more.",81
0,310950,"['Single-player', 'Multi-player', 'Cross-Platform Multiplayer', 'Steam Achievements', 'Full controller support', 'Steam Trading Cards', 'Remote Play on Phone', 'Remote Play on Tablet', 'Remote Play on TV']",Action,https://cdn.akamai.steamstatic.com/steam/apps/310950/header.jpg?t=1650011214,"Experience the intensity of head-to-head battles with Street Fighter® V! Choose from 16 iconic characters, then battle against friends online or offline with a robust variety of match options.",89
0,211820,"['Single-player', 'Multi-player', 'PvP', 'Online PvP', 'Co-op', 'Online Co-op', 'Cross-Platform Multiplayer', 'Steam Achievements', 'Steam Trading Cards', 'Steam Workshop']",Action,https://cdn.akamai.steamstatic.com/steam/apps/211820/header.jpg?t=1611668796,"You’ve fled your home, only to find yourself lost in space with a damaged ship. Your only option is to beam down to the planet below, repair your ship and set off to explore the universe...",81
